topik,URL,Title,Question,Question Date,Answer,Answer Date,By Doctor
adhd,https://www.alodokter.com/komunitas/topic/-adhd-pada-dewasa--bagaimana-tanda-tanda-nya-,Apakah ada kondisi ADHD pada orang dewasa?,"""\n\n\u003cp\u003eDokter,\u003c/p\u003e\n\u003cp\u003e2 minggu lalu beberapa keluarga dan teman saya meninggal dunia. Sejak saat itu, saya sangat sulit untuk: kembali fokus, saya juga sulit mengatur prioritas saya, saya sering sekali berhenti sejenak karena sedih, saya merasa mudah sekali terdistraksi dengan hal-hal kecil kemudian tidak bisa menyelesaikan tugas saya, sering sekali mengalami ketakutan tanpa tau sebabnya, saya juga sangat sulit tidur. Karena hal-hal ini saya sangat takut untuk memulai hari saya dipagi hari.\u003c/p\u003e\n\u003cp\u003eSaya seorang researcher tinggal dan sedang bertugas di Vietnam, semua hal diatas membuat saya sangat sulit untuk bekerja. Teman saya yang memiliki ADHD menyarankan untuk bertanya, apakah ada ADHD ceklist untuk mendiagnosa diri saya? dan apa yg bisa saya lakukan untuk menghilangkan/mengurangi rasa takut saya dan membantu saya untuk bisa fokus bekerja? Terimakasih sebelumnya dan mohon bantuannya.\u003c/p\u003e\n\u003cp\u003ebest,\u003c/p\u003e\n\u003cp\u003eP\u003c/p\u003e\n\u003cp\u003eÂ \u003c/p\u003e\n""","19 Juli 2021, 22:23","""\n\n\u003cp\u003eAlo Putri,\u003c/p\u003e\n\u003cp\u003eTerima kasih telah bertanya di Alodokter.\u003c/p\u003e\n\u003cp\u003eKami memahami perasaan Anda saat ini. Setiap orang pasti pernah mengalami kesedihan, namun kesedihan ini dapat membaik dan tidak berlangsung lama. Sesekali dapat muncul kembali rasa sedih tersebut apabila disertai dengan faktor pemicu nya. Namun jika terjadi gangguan aktivitas sehari-hari maka sebaiknya perlu dilakukan pemeriksaan dan evaluasi lebih lanjut.\u003c/p\u003e\n\u003cp\u003e\u003ca href=\""https://www.alodokter.com/adhd\""\u003eADHD\u003c/a\u003e (\u003cem\u003eattention deficit hyperactivity disorder\u003c/em\u003e) adalah gangguan mental dengan karakteristik berupa sulit untuk memusatkan perhatian dan hiperaktif yaitu sulit untuk berdiam diri dan cenderung bergerak.Biasanya hal ini akan muncul sejak dari usia anak sebelum 12 tahun.ADHD bisa juga menyerang remaja dan orang dewasa, tapi itu hanya jika orang tersebut memang sudah terkena ADHD dari kecil yang penyakitnya terus bertahan. Kondisi ADHD pada dewasa dengan tidak memiliki riwayat ADHD sebelumnya belum pernah terjadi. Sehingga perlu dipastikan apakah Anda memiliki riwayat ADHD sewaktu kecil ?\u003c/p\u003e\n\u003cp\u003eKondisi yang Anda alami saat ini juga dapat diakibatkan oleh beberapa kondisi lain seperti \u003ca href=\""https://www.alodokter.com/ketahui-cara-mengatasi-gangguan-kecemasan\""\u003egangguan kecemasan\u003c/a\u003e, gangguan panik, \u003ca href=\""https://www.alodokter.com/ptsd\""\u003ePTSD\u003c/a\u003e(\u003cem\u003epost traumatic stress disorder\u003c/em\u003e), depresi dan kondisi lainnya. Untuk mengetahui penyebab kondisi Anda saat ini, Anda dapat berkonsultasi dengan \u003ca href=\""https://www.alodokter.com/cari-dokter/dokter-jiwa\""\u003edokter psikiatri \u003c/a\u003eatau psikolog. Dokter akan melakukan pemeriksaan mulai dari wawancara singkat terkait kondisi Anda, pemeriksaan fisik dan pemeriksaan penunjang apabila diperlukan. Sehingga mengetahui penyebab kondisi Anda saat ini dan dapat diberikan penanganan yang sesuai.\u003c/p\u003e\n\u003cp\u003eSementara itu, beberapa anjuran yang dapat Anda lakukan :\u003c/p\u003e\n\u003cul\u003e\n\u003cli\u003eIstirahat yang cukup\u003c/li\u003e\n\u003cli\u003eCeritakan kondis yang Anda Alami saat ini dengan orang yang Anda percayai seperti teman, saudara\u003c/li\u003e\n\u003cli\u003eJika sulit bercerita, Anda dapat menuliskan nya didalam sebuah buku catatan\u003c/li\u003e\n\u003cli\u003eHindari menyendiri\u003c/li\u003e\n\u003cli\u003eAlihkan pikiran negatif ke kegiatan positif yang Anda senangi\u003c/li\u003e\n\u003cli\u003eCobalah saat hendak melakukan sesuatu, tulis di buku catatan atau\u003cem\u003enote\u003c/em\u003e hp Anda sehingga Anda dapat mengingat kegiatn apa yang belum dan sudah Anda lakukan\u003c/li\u003e\n\u003cli\u003eCobalah lakukan kegiatan dengan perlahan, dapat diselingi dengan mendengarkan musik yang Anda sukai\u003c/li\u003e\n\u003cli\u003eLakukan olahraga rutin\u003c/li\u003e\n\u003cli\u003eLakukan relaksasi dengan meditasi atau yoga\u003c/li\u003e\n\u003c/ul\u003e\n\u003cp\u003eSemoga membantu ya\u003c/p\u003e\n\u003cp\u003eSalam\u003c/p\u003e\n\u003cp\u003e\u003c/p\u003e\n\n""","20 Juli 2021, 11:31",dr. Irma Noor Budianti
adhd,https://www.alodokter.com/komunitas/topic/apakah-saya-punya-adhd-atau-gangguan-mental-lain-,"Penyebab susah fokus, sering melamun, dan sering lupa","""\n\n\u003cp\u003eSelamat sore dok. Saya berusia 17 tahun. Saya entah mengapa susah fokus, sering melamun, sering lupa, dll. Saya sudah melakukan berbagai cara untuk mengubah habit saya tapi tidak ada yang berhasil sampai kedua ortu saya sudah capek. Saya sudah konsultasi pula ke psikolog dan sudah diberi latihan yang lain, awalnya selalu berjalan lancar tapi diakhir2 saya kembali ke awal. Saat saya memang sedang benar2 fokus dengan suatu hal yang saya lakukan yang lainnya terlupakan karena saya terpaku pada satu hal yang saya sedang kerjakan itu saja. Lalu entah mengapa di beberapa hari kemudian saya bisa tiba-tiba sad, lazy, seperti tidak ada energi. Di hari-hari seperti itu brain saya terasa off, tidak bisa berpikir jernih, sering melakukan kesalahan-kesalahan sepele. Saya juga sulit mencerna informasi yang kurang detail. Saya ingat dulu saya juga sering kurang fokus dan memang hiperaktif, tapi sekarang saya tidak hiperaktif lagi justru saya sekarang pendiam. Kira-kira saya kenapa ya, dok? Tolong jawabannya karena saya juga sudah bingung ada apa dengan saya..\u003c/p\u003e\n""","14 Mei 2021, 17:30","""\n\n\u003cp\u003eAlo Bsdtalia,\u003c/p\u003e\n\u003cp\u003eTerimakasih telah bertanya di Alodokter.\u003c/p\u003e\n\u003cp\u003eSering lupa dan kesulitan untuk fokus umumnya sering dialami oleh setiap orang. Selama keluhan tidak mengganggu aktivitas maka hal tersebut wajar terjadi. Namun, apabila keluhan yang terjadi telah berlangsung lama hingga mengganggu aktivitas maka perlu dievaluasi lebih lanjut. Menilik dari apa yang anda sampaikan serta anda keluhkan saat ini, perlu dipahami bahwa \u003cem\u003eAttention deficit hyperactivity disorder\u003c/em\u003e(\u003ca href=\""https://www.alodokter.com/adhd/gejala\""\u003eADHD\u003c/a\u003e) merupakan salah satu kelainan perkembangan terbanyak pada masa anak dan dapat berlangsung sampai masa remaja dan dewasa. Umumnya gejala ADHD pada anak sudah muncul sejak usia 3 tahun.\u003c/p\u003e\n\u003cp\u003eGejala ADHD pada anakGejala utama ADHD adalah sulit memusatkan perhatian, serta menunjukkan perilaku hiperaktifdan impulsif. Dimana pada anak dengan ADHD keluhan bertambah parah. Keluhan yang muncul seperti tidak fokus dalam mengerjakan sesuatu, perhatian teralihkan, tidak memperhatikan hal detail, ceroboh dan lain-lain. Pada ADHD yang dialami usia dewasa biasanya sebelumnya pernah mengalami ADHD pada masa kecil.Gejala hiperaktif pada ADHD biasanya akan berkurang seiring bertambahnya usia. Namun sebaliknya, gejala sulit memusatkan perhatian cenderung bertambah parah seiring pertambahan usia.\u003c/p\u003e\n\u003cp\u003eSaat ini, karena keterbatasan informasi dan perlunya evaluasi lebih lanjut, sangat perlu dipastikan penyebab kondisi anda saat ini. Karena untuk mendiagnosis suatu penyakit perlunya pemeriksaan mulai dari riwayat medis, pemeriksaan fisik hingga penunjang yang diperlukan. Selain itu, kondisi seperti \u003ca href=\""https://www.alodokter.com/mungkin-ini-alasan-kamu-sering-lupa\""\u003esering lupa dan tidak fokus \u003c/a\u003ejuga dapat diakibatkan oleh beberapa kondisis seperti :\u003c/p\u003e\n\u003cul\u003e\n\u003cli\u003eKurangnya tidur\u003c/li\u003e\n\u003cli\u003eBanyak konsumsi beberapa obat\u003c/li\u003e\n\u003cli\u003eGangguan emosi\u003c/li\u003e\n\u003cli\u003eAdanya gangguan medis tertentu seperti gangguan hormon tiroid, riwayat cidera kepala\u003c/li\u003e\n\u003cli\u003eKurang konsumsi vitamin B12\u003c/li\u003e\n\u003cli\u003eSering mengkonsumsi alkohol\u003c/li\u003e\n\u003c/ul\u003e\n\u003cp\u003eSebaiknya, untuk memastikan kondisi anda saat ini, Anda dapat berkonsultasi dengan dokter. Anda dapat berkonsultasi dengan dokter psikiatri dengan langsung bertemu tatap muka, ataupun Anda dapat berkonsultasi melalui fitur chat yang ada di Alodokter. Dokter akan dapat mengevaluasi lebih lanjut sehingga dapat memberikan penanganan yang sesuai.\u003c/p\u003e\n\u003cp\u003eSaat ini, adapun beberapa anjuran yang dapat anda lakukan, seperti :\u003c/p\u003e\n\u003cul\u003e\n\u003cli\u003eMinimalisir aktivitas fisik yang berat dan melelahkan\u003c/li\u003e\n\u003cli\u003eIstirahat cukup, hindari untuk tidur larut malam\u003c/li\u003e\n\u003cli\u003eKerjakan sesuatu dengan fokus mulai dari melakukan hal kecil, selesaikan satu persatu yang hendak anda kerjakan.\u003c/li\u003e\n\u003cli\u003eAnda bisa menuliskan apa yang hendak anda kerjakan atau menuliskannya di catatan smartphone anda sehingga anda tau apa yang anda hendak kerjakan\u003c/li\u003e\n\u003cli\u003eMengelola stres dengan baik\u003c/li\u003e\n\u003cli\u003eSering berinteraksi dengan orang sekitar anda\u003c/li\u003e\n\u003cli\u003eJaga asupan nutrisi\u003c/li\u003e\n\u003cli\u003eOlahraga rutin\u003c/li\u003e\n\u003cli\u003eHindari konsumsi Alkohol dan rokok\u003c/li\u003e\n\u003c/ul\u003e\n\u003cp\u003eSemoga membantu ya\u003c/p\u003e\n\u003cp\u003eSalam\u003c/p\u003e\n\n""","15 Mei 2021, 09:06",dr. Irma Noor Budianti
adhd,https://www.alodokter.com/komunitas/topic/diagnosa-adhd-dewasa,Ciri-ciri gejala Attention deficit hyperactivity disorder (ADHD) pada orang dewasa,"""\n\n\u003cp\u003eSelamat pagi, Dokter. Saya mahasiswa wanita smt. 9. Saat ini mengalami kendala perkuliahan akibat kurang fokus. Sejak kecil Saya mudah sekali bosan, sulit duduk diam, tidak bisa mendengarkan dalam waktu lama, tidak bisa berada dalam ruangan dalam waktu lama, terkadang sulit menangkap pembicaraan karena ketidakfokusan Saya. Saya juga sering sakit kepala jika memaksakan konsentrasi, emosi tidak stabil, sulit mengingat wajah dan nama, serta hiperfokus jika sedang sangat semangat sampai terkadang migrain kambuh. Saya pikir hal-hal seperti ini wajar dialami orang lain. Ternyata banyak teman Saya menganggap apa yang Saya alami bukan hal wajar. Saya juga akhir akhir ini mengalami depresi karena beberapa masalah yang mengekor dari perilaku-perilaku tersebut.\u003c/p\u003e\n\u003cp\u003eApakah ini termasuk ADHD, Dok? Apakah Saya perlu CT scan?\u003c/p\u003e\n""","28 September 2021, 11:08","""\n\n\u003cp\u003eAlo Huriyatul,\u003c/p\u003e\n\u003cp\u003eTerima kasih telah bertanya di Alodokter.\u003c/p\u003e\n\u003cp\u003e\u003cem\u003eAttention deficit hyperactivity disorder\u003c/em\u003e(\u003ca href=\""https://www.alodokter.com/adhd/gejala\""\u003eADHD\u003c/a\u003e) merupakan salah satu kelainan perkembangan terbanyak pada masa anak dan dapat berlangsung sampai masa remaja dan dewasa. Umumnya gejala ADHD pada anak dapat muncul sejak usia 3 tahun.Biasanya hal ini akan muncul sejak dari usia anak \u0026lt;12 tahun dan dapat juga baru terjadi pada dewasa, dengan insidensi yang lebih jarang dan sekitar 50 sampai dengan 60% sudah terdiagnosa ADHD pada anak namun mengalami kejadian kambuh atau berulang hingga usia dewasa. Gejala ADHD pada anak adalah sulit memusatkan perhatian, serta menunjukkan perilaku hiperaktif dan impulsif. Sehingga, pada ADHD yang dialami usia dewasa biasanya sebelumnya pernah mengalami ADHD pada masa kecil. Gejala hiperaktif pada ADHD biasanya akan berkurang seiring bertambahnya usia. Namun sebaliknya, gejala sulit memusatkan perhatian cenderung bertambah parah seiring pertambahan usia.\u003c/p\u003e\n\u003cp\u003eMelihat dari apa yang Anda sampaikan, keluhan yang Anda alami telah berlangsung cukup lama dan menimbulkan adanya gangguan aktivitas, tentu sebaiknya diperlukan pemeriksaan dan evaluasi lebih lanjut. Adapun kondisi yang Anda alami seperti sulit fokus, sulit berkonsentrasi dapat disebabkan oleh penyebab lain seperti :\u003c/p\u003e\n\u003cul\u003e\n\u003cli\u003eKurangnya tidur\u003c/li\u003e\n\u003cli\u003eAdanya gangguan medis tertentu seperti gangguan hormon tiroid, riwayat cidera kepala\u003c/li\u003e\n\u003cli\u003eKurang konsumsi vitamin B12\u003c/li\u003e\n\u003cli\u003eSering mengkonsumsi alkohol\u003c/li\u003e\n\u003cli\u003eEfek samping konsumsi obat-obatan tertentu\u003c/li\u003e\n\u003cli\u003eStres psikologis\u003c/li\u003e\n\u003c/ul\u003e\n\u003cp\u003eAdapun seperti yang Anda sebutkan adanya kondisi stres, depresi yang Anda sebutkan, dapat merupakan salah satu faktor pencetus yang Anda alami saat ini. Maka dari itu, kami sarankan saat ini agar Anda dapat berkonsultasi dengan \u003ca href=\""https://www.alodokter.com/cari-dokter/dokter-jiwa\""\u003edokter spesialis psikiatri\u003c/a\u003e. Dokter akan melakukan pemeriksaan sehingga dapat diketahui penyebab keluhan serta dapat diberikan penanganan yang sesuai. Sementara itu, adapun beberapa anjuran yang dapat Anda lakukan seperti :\u003c/p\u003e\n\u003cul\u003e\n\u003cli\u003eMinimalisir aktivitas fisik yang berat dan melelahkan\u003c/li\u003e\n\u003cli\u003eIstirahat cukup, hindari untuk tidur larut malam\u003c/li\u003e\n\u003cli\u003eKerjakan sesuatu dengan fokus mulai dari melakukan hal kecil, selesaikan satu persatu yang hendak anda kerjakan.\u003c/li\u003e\n\u003cli\u003eAnda bisa menuliskan apa yang hendak anda kerjakan atau menuliskannya di catatan smartphone anda sehingga anda tau apa yang anda hendak kerjakan\u003c/li\u003e\n\u003cli\u003eMengelola stres dengan baik\u003c/li\u003e\n\u003cli\u003eSering berinteraksi dengan orang sekitar anda\u003c/li\u003e\n\u003cli\u003eJaga asupan nutrisi\u003c/li\u003e\n\u003cli\u003eOlahraga rutin dan Anda dapat melakukan teknik relaksasi\u003c/li\u003e\n\u003c/ul\u003e\n\u003cp\u003eSemoga membantu ya\u003c/p\u003e\n\u003cp\u003eSalam\u003c/p\u003e\n\n""","28 September 2021, 13:22",dr. Irma Noor Budianti
adhd,https://www.alodokter.com/komunitas/topic/anak-3-thun-aktif-sekali-apakah-bisa-dikategorikan-hyper-aktif--,Anak 3 tahun aktif sekali apakah bisa dikategorikan hiperaktif?,"""\n\n\u003cp\u003eSelamat siang dok saya seorang ibu 30thn,,, dan usia anak sya 3thun bln kmren...Anak sya gabisa diem banget dok,dia diem klo nonton hp bisa smpe berjam2 kalo dya biarkan,klo sya stop dia lari kesana kesni,smpe yg ngasuh pun ga ada yg sanggup saking aktifnya TPI setelah kecapean anak sya bisa tidur siang sampai 3/4jam.Anak sya klo jajan bnyak bnget,,apa yg Dimau harus dituruti klo tidak ngamuk2,,apalgi klo melihat mainan,,hampir setiap hari bli mainan mobil \u0026amp; excavator favorite nya..Kadang sya kerepotan mengasuh,dan pengasuh pun bnyk yg gak sanggup, jdi kadang diasuh oleh santri2Kelebihannya anak saya jika terjatuh dia tidak pernah menangis,dan dya cepat tanggap klo nnton vdio suka yg bahasa Inggris dan kdang jg Aya ajarkan bhsa Inggris dan mudah tangkap dan hafal..Anaknya bawel banget,cuma itu tdi dia GK bisa diem bisa berjam2 lari2 trus ksna kesni GK bisa duduk manis,apakah anak saya harus dbwa ke dokter untuk terapi / nggak dok? Apakah anak sya termasuk autis?Tpi dya skrg2 bisa bersosialisasi dengan murid2 sekolah dirumah dr yg kecil sampai yg dewasa. Cuma gbisa diem bngt. Terimakasih atas tggapannya\u003c/p\u003e\n""","10 Maret 2021, 11:27","""\n\n\u003cp\u003eAlo Honi,\u003c/p\u003e\n\u003cp\u003eTerima kasih atas pertanyaannya.\u003c/p\u003e\n\u003cp\u003eUntuk mengetahui secara lebih pasti apakah anak memang hiperaktif secara medis, atau yang disebut juga sebagai\u003cem\u003e\u003ca href=\""https://www.alodokter.com/adhd\""\u003eADHD (attention deficit hyperactivity disorder)\u003c/a\u003e,\u003c/em\u003edibutuhkan evaluasi dan observasi yang lebih lanjut, sebagaimana keluhan yang terjadi biasanya muncul secara terus menerus dalam 6 bulan terakhir. Selain itu, terdapat beberapa gejala lain yang muncul, seperti anak tidak dapat memberikan perhatian pada suatu hal yang detail, sering melakukan kegiatan tertentu secara berulang-ulang, berbicara terlalu banyak, tidak bisa menunggu giliran, dan lainnya. Gejala tersebut pun biasanya menimbulkan keterbatasan yang signifikan dalam aktivitasnya belajar, menjalani keseharian, dan fungsi sosialnya dengan orang lain.\u003c/p\u003e\n\u003cp\u003eApabila Anda merasa keluhan yang dialami oleh anak Anda sudah menimbulkan gangguan yang signifikan, maka Anda dapat memeriksakannya ke dokter spesialis anak untuk mendapatkan evaluasi lebih lanjut, termasuk mengonfirmasi apakah terdapat kelainan tertentu yang dialami oleh anak Anda, seperti ADHD ataupun gangguan autisme, sehingga dokter dapat memberikan penanganan yang sesuai. Untuk sementara waktu, pastikan kebutuhan anak terpenuhi termasuk nutrisinya, lakukan banyak kegiatan bersama dengan anak, kurangi paparan gadget, upayakan untuk mendisiplinkan anak dengan baik, serta bersabar dalam menghadapi perilaku anak yang cerewet dan tidak bisa diam.\u003c/p\u003e\n\u003cp\u003eSemoga informasi ini dapat membantu.\u003c/p\u003e\n\u003cp\u003eSalam.\u003c/p\u003e\n\n""","10 Maret 2021, 14:05",dr. Talitha Najmillah Sabtiari
adhd,https://www.alodokter.com/komunitas/topic/gangguan-belajar-anak,Bagaimana cara mengatasi gangguan belajar pada anak,"""\n\n\u003cp\u003edear dok,anak sy usia 10 thn,perempuan,anak tengah, dahulu tdk ada gangguan belajar yg brarti,malah pernah meraih juara kelas. Tapi sejak kls 3 dia sdh mulai malas belajar,tulisan tdk rapi,kemudian kls 4 makin parah,gurunya srg mengeluh ke saya klw dia tdk selesai di sklh,srg salah mengerjakan instruksi.Skrg dia di kls 5,karena belajar daring makin malas,pdhl tugas dr sekolah tdk byk tp sll menghindar mengerjakan tugas.Anak sy jg skrg suka tetiba berteriak,membangkang,melawan,mendesak jk ada keinginan,membanting benda jika marah,membentak dan kasar ke adiknya (1,4 yo),bertindak impulsif. Setiap hari sprt biang kerok di rmh. sy sdh mencoba menerapkan ilmu parenting dan bersabar. tp terlihat tdk ada hasil dan makin parah belakangan ini. sampai sy berfikir mgkn kah anak sy ADHD? apakah gejala adhd bs muncul stlh usia 8 thn? bisakah disembuhkan? bagaimana penegakan diagnosis dan pengobantannya?Thanks in advance,doc\u003c/p\u003e\n""","28 Januari 2021, 15:57","""\n\n\u003cp\u003eAlo Julia, terima kasih ya sudah bertanya di Alodokter.\u003c/p\u003e\n\u003cp\u003eBerdasarkkan usia munculnya gejala, ADHD dapat terbagi menjadi 2 tipe, yaitu ADHD yang terjadi pada anak-anak dan ADHD yang terjadi pada saat dewasa (lebih jarang). ADHD pada anak-anak, meskipun seringkali sudah muncul pada saat anak berusia kurang dari 6 tahun namun dapat pula muncul pada usia lebih dari 6 tahun hingga 12 tahun.\u003c/p\u003e\n\u003cp\u003eUntuk menegakkan diagnosa suatu ADHD, terdapat kriteria-kriteria tertentu yang harus dipenuhi yang mana penilaian dan penegakkannya harus dilakukan secara khusus oleh psikiater, oleh karena itu, cukup dianjurkan untuk membawa anak anda ke psikiater untuk dilakukan evaluasi secara langsung pada keluhan yang anda temukan selama ini dan juga berdasarkan hasil pengamatan dokter secara langsung terhadap anak anda. Pengobatan pun baru akan ditetapkan setelah dipastikan kondisi / gangguan apa yang dialami oleh anak anda. Tidak disarankan memberikan obat-obatan apapun (khususnya obat ADHD) tanpa anjuran yang jelas dari dokter.\u003c/p\u003e\n\u003cp\u003eSementara ini, selain memeriksakan kondisi anak anda ke dokter, anda juga disarankan untuk tetap memberikan pengertian apa pentingnya belajar, menyelesaikan tugas-tugas yang diberikan kepadanya dan berperilaku baik kepada orang lain. Selain itu, sangat disarankan pula untuk mendampingi anak anda lebih lagi, terutama ketika anak anda sedang bersikap impulsif. Tetaplah bersabar dalam menghadapi sikap anak anda saat ini dan berusahalah untuk tetap tegas.\u003c/p\u003e\n\u003cp\u003eSemoga membantu.\u003c/p\u003e\n\n""","28 Januari 2021, 19:39",dr. Velika Devina
adhd,https://www.alodokter.com/komunitas/topic/apakah-anak-umur-3-tahun-bisa-menderita-adhd-,Apakah anak usia 3 tahun bisa menderita ADHD?,"""\n\n\u003cp\u003eHalo dok,Saya punya keponakan perempuan berumur kurang dr 3 tahun (tahun ini masuk 3 tahun). Keponakan saya ini suka nangis keras, sampai sekarang jg dia belum bisa berbicara dg jelas (manggil ayah dan bunda yg tdny bs sekarang gak bs), kadang kala dia suka bangun malam2 terus menangis keras dan kadang kala dia tidak tidur pas malam2 jd paginya tidur. Saat diajak ngomong, anak tidak melihat ke lawan bicaranya (kecuali ibu dan ayahnya), suka marah2. Ketika dia selesai main, saat mainannya dibereskan, dia langsung marah dan ngeberantakin lg mainannya. Keponakan saya sudah dibawa ke dokter anak dan saat ini sedang terapi sudah jalan 6 bulan, namun krn lg psbb, terapinya berhenti dulu. Dokter anak yg kakak saya kunjungin mengatakan anak kakak saya kemungkinan menderita adhd. Apakah anak umur 3 tahun bisa menderita adhd krn saat saya cari sumber2 tentang adhd, kebanyakan menderita saat umur 6 tahun keatas? Dan bagaimana penanganan yg bisa dilakukan saat terapinya berhenti dulu? Mohon bantuannya, tks.\u003c/p\u003e\n""","27 Januari 2021, 12:21","""\n\n\u003cp\u003eAlo, terima kasih sudah bertanya di Alodokter.\u003c/p\u003e\n\u003cp\u003eADHD atau\u003cstrong\u003ea\u003c/strong\u003e\u003cem\u003e\u003cstrong\u003ettention deficit hyperactivity disorder\u003c/strong\u003e\u003c/em\u003emerupakan suatu bentuk gangguan mental di mana anak mengalami kesulitan dalam memusatkan perhatian serta memiliki perilaku yang impulsif dan hiperaktif. Pada umumnya ADHD pada anak terjadi sebelum anak menginjak usia 12 tahun, namun pada banyak kasus gejala ADHD pada anak sudah mulai tampak sejak usia lebih kurang 3 tahun. Gejala-gejala ini akan semakin terlihat mencolok seiring bertambahnya usia sang anak.\u003c/p\u003e\n\u003cp\u003eBelum diketahui secara pasti penyebab ADHD, namun beberapa faktor yang saling berkombinasi dinilai menjadi penyebab timbulnya ADH diantaranya faktor keturunan, kelahiran premature, kelainan struktur maupun fungsi otak anak, kerusakan otak anak yang terjadi sejak dalam kandungan, dan sebagainya.\u003c/p\u003e\n\u003cp\u003ePerlu diketahui bahwa ADHD tidak dapat disembuhkan sepenuhnya, namun kondisi ini dapat dikendalikan guna meredakan gejala-gejala yang timbul sehingga sehari-hari anak dapat beraktivitas normal seperti biasanya. Penananganan dilakukan dengan penggunaan obat-obat tertentu dan juga melalui psikoterapi. Di samping hal tersebut beberapa hal dapat dilakukan oleh orang tua guna membantu keberhasilan penanganan diantaranya:\u003c/p\u003e\n\u003cul\u003e\n\u003cli\u003eMemastikan anak cukup mendapat asupan nutrisi yang sehat dan bergizi\u003c/li\u003e\n\u003cli\u003eMemberikan anak cukup cairan\u003c/li\u003e\n\u003cli\u003ePastikan anak cukup istirahat\u003c/li\u003e\n\u003cli\u003eBatasi waktu anak dalam menonton televisi atau menggunakan komputer/ponsel\u003c/li\u003e\n\u003cli\u003eAjaka anak untuk beraktifitas fisik setidaknya 1 jam setiap harinya\u003c/li\u003e\n\u003c/ul\u003e\n\u003cp\u003eJika terdapat keluhan selama proses penanganan yang sedang berjalan jangan ragu untuk berkonsultasi kembali pada dokter anak anda. Guna menambah informasi mengenai ADHD, artikel \u003ca href=\""https://www.alodokter.com/adhd/penanganan\""\u003eberikut\u003c/a\u003e dapat anda baca.\u003c/p\u003e\n\u003cp\u003eSekian, semoga bermanfaat.\u003c/p\u003e\n\n""","28 Januari 2021, 15:17",dr. Singgih E Prasetyo
