topik,URL,Title,Question,Question Date,Answer,Answer Date,By Doctor
adhd,https://www.alodokter.com/komunitas/topic/adhd-pada-orang-dewasa,Bagaimana cara mengatasi ADHD pada orang dewasa,"""\n\n\u003cp\u003eHalo dok, salam.\u003c/p\u003e\n\u003cp\u003eSaya pria berumur 23 tahun. 2 tahun belakangan ini, sejak Agustus 2017, saya merasa depresi yang umumnya disebabkan oleh pekerjaan pertama saya yang telah saya jalani selama 3 tahun. Hal itu merambat ke aspek kehidupan saya yang lain seperti di rumah, atau dalam pertemanan saya dimana saya menjadi semakin tertutup dan secara tidak langsung menjauhkan diri. Dalam pekerjaan, saya sering melakukan kesalahan-kesalahan sepele yang disebabkan oleh sifat saya yang kurang fokus terhadap hal-hal kecil. Selain itu, saya sering secara tidak sadar melakukan tindakan impulsif, terutama dalam pekerjaan saya yang berakibat pada ketidak-sesuaian hasil impuls saya dengan perintah atasan saya. Kesalahan-kesalahan tersebut yang mengakibatkan saya memiliki pikiran negatif seperti \u003cem\u003eanxiety, inferiority complex, \u003c/em\u003ehingga mengalami \u003cem\u003eburnout\u003c/em\u003e yang memperburuk kondisi saya.\u003c/p\u003e\n\u003cp\u003eSetelah melakukan banyak kesalahan sepele, saya melakukan \u003cem\u003esearching\u003c/em\u003e mengenai hal yang saya alami. Setelah membaca cukup artikel mengenai masalah diatas, saya berkesimpulan saya mengidap ADHD. Selain masalah diatas, saya menyadari bahwa dari kecil saya memang sulit untuk belajar secara konvensional di kelas, kecuali pada mata pelajaran yang saya sukai. Disamping itu, saya juga merasa â€œfidgetyâ€, dimana saya sering secara tidak sadar menghentak-hentakkan kaki saat duduk, atau bermain dengan barang kecil disekitar meskipun itu bukan milik saya seperti pulpen. Banyak kesesuaian gejala ADHD yang tidak bisa saya sebutkan pada kesempatan ini.\u003c/p\u003e\n\u003cp\u003eSaya ingin bertanya, bila saya melakukan konsultasi dengan dokter spesialis dan terdiagnosa dengan ADHD, apakah saya bisa mendapatkan surat resmi yang menyatakan bahwa saya mengidap ADHD? Selain itu, apakah benar ADHD tidak dapat disembuhkan secara total, hanya dapat diobati secara berkala? Terima kasih dok, atas waktunya.\u003c/p\u003e\n\u003cp\u003e\u003c/p\u003e\n\u003cp\u003eSalam,\u003c/p\u003e\n\u003cp\u003eMr. K\u003c/p\u003e\n\n""","24 Agustus 2019, 20:42","""\n\n\u003cp\u003eAlo selamat malam Ibu Rizqi Bella. Terimakasih telah bertanya ke Alodokter\u003c/p\u003e\n\u003cp\u003eADHD (attention deficit hyperactivity disorder) adalah gangguan mental dengan karakteristik berupa inatensi yaitu sulit untuk memusatkan perhatian dan hiperaktif yaitu sulit untuk berdiam diri dan cenderung bergerak. Biasanya hal ini akan muncul sejak dari usia anak \u0026lt;12 tahun dan dapat juga baru terjadi pada dewasa, dengan insidensi yang lebih jarang dan sekitar 50 sampai dengan 60% sudah terdiagnosa ADHD pada anak namun mengalami kejadian kambuh atau berulang. Biasanya gejala yang terjadi pada dewasa adalah sulit untuk bertanggung jawab akan satu hal, sulit untuk melalukan suatu yang rumit dan rutin, tidak suka mendegarkan orang lain, lebih sulit mengontrol emosi.\u003c/p\u003e\n\u003cp\u003eBila mengalami hal tersebut sebaiknya konsultasikan kondisi Anda ke \u003ca href=\""https://www.alodokter.com/cari-dokter/dokter-jiwa\""\u003edokter spesialis jiwa \u003c/a\u003eatau psikologi, hal ini karena agar dapat dipastikan bahwa Anda benar mengalami ADHD atau hal lainnya. Beberapa hal yang mungkin adalah\u003c/p\u003e\n\u003col\u003e\n\u003cli\u003eDepresi adalah suatu kondisi kesedihan, hilang energi, dan hilang minat yang dapat disebabkan oleh suatu kondisi atau tidak. Biasanya kondisi ini bertahan lebih dari 2 minggu dan dapat menganggu fungsi hidup sehari-hari sepert pekerjaan , sekolah, sampai dengan aktivitas mandi makan dan lainnya\u003c/li\u003e\n\u003cli\u003eBipolar adalah kondisi dimana suatu saat mengalami kesedihan yang mendalam selama sekitar 2 minggu kemudian berganti menjadi kondisi senang luar biasa, melakukan suatu yang berlebihan, pakaian dengan warna yang sangat terang dan tidak senada yang berlangsung sekitar 1 bulan. Dan hal ini dapat bergantian dan berselang-seling sesuai dengan kondisi psikologis.\u003c/li\u003e\n\u003c/ol\u003e\n\u003cp\u003eMengenai pengobatan secara umum pengobatan seseorang degan gagguan psikologis dimulai dengan konsultasi kemudian biasanya akan dilanjutkan dengan psikoterapi kognitif yang berguna untuk membentuk pola pikir yang lebih baik yang kemudian dapat digunakan sebagai pola pikir yang baru dan diharapkan dapat membentuk hal yang lebih baik. Bila tidak berhasil biasanya dapat dibantu dengan obat. Penyembuhan akan bervariasi tergantung dari kondisi seseorang dan dukungan dari keluarga dan orang terdekat.\u003c/p\u003e\n\u003cp\u003elebih lanjut mengenai ADHD dapat dibaca pada\u003ca href=\""https://www.alodokter.com/adhd\""\u003e artikel ini\u003c/a\u003e\u003c/p\u003e\n\u003cp\u003eDemikian hal yang dapat kami sampaikan. Semoga Bermanfaat. Terimakasih\u003c/p\u003e\n\n""","24 Agustus 2019, 23:57",dr. Florentina Priscilia
adhd,https://www.alodokter.com/komunitas/topic/saya-ingin-tahu-apakah-saya-punya-penyakit-add-atau-tidak,Kalau saya ingin tahu apakah saya punya penyakit ADD atau tidak kemana periksanya?,"""\n\n\u003cp\u003eMalam Bpk/ Ibu Dokter,\u003c/p\u003e\n\u003cp\u003eSebelumnya perkenalkan, nama saya Zharfan umur 25 tahun. Saat ini saya bekerja sebagai seorang konsultan di Jakarta. Tetapi selama saya bekerja saya sering susah fokus terutama dalam organizing file dan ketelitian. Saya juga sering susah tanggap kalau mendengarkan orang berbicara. \u003c/p\u003e\n\u003cp\u003ePada awalnya sekitar 2 (dua) tahun lalu saya mengira ini hanya penyakit remaja yang masih sering malas-malasan dan hanya pengen senang-senang saja. Tetapi, sekarang saya makin kesulitan terutama jika saat harus membuat report ke klien.. saya sering melewatkan hal2 detail dan sering melakukan kesalahan yang sepele.. saya juga sering lupa menaruh kacamata ataupun kunci rumah. Saat saya sedang mencari bagaimana melatih fokus, saya kenal dengan penyakit ADD (Atention Defisit Disorder) saya ingin tau lebih lanjut tentang gangguan ini dan ingin melakukan konsultasi lebih lanjut.\u003c/p\u003e\n\u003cp\u003e\u003c/p\u003e\n\u003cp\u003eTerima kasih.\u003c/p\u003e\n\u003cp\u003e\u003cbr\u003e\u003c/p\u003e\n\n""","7 Februari 2019, 21:53","""\n\n\u003cp\u003eAlo Zharfan,\u003c/p\u003e\n\u003cp\u003eBerdasarkan keterangan yang Anda berikan tersebut mungkin saja Anda mengalami gangguan untuk berkonsentrasi, tetapi hal ini mungkin saja hanya bersifat sementara yang dapat dipengaruhi banyak faktor, dan bukanlah pasti suatu gangguan/penyakit ADD. Untuk menentukan apakah Anda menderita ADD atau tidak tentunya harus dilakukan pemeriksaan tertentu yang dapat menegakkan diagnosa. ADD atau Attention Deficit Disorder adalah suatu gangguan pemusatan perhatian atau konsentrasi. Berbeda dengan ADHD, ADHD sendiri merupakan kondisi dimana terjadi gangguan pemusatan perhatian, sulit berkonsentrasi dan juga terjadi hiperaktif atau aktifitas yang berlebihan secara tidak teratur. ADHD biasa sudah dapat terdeteksi sejak masa kanak-kanak. Sedangkan penyakit ADD sering ditemukan pada usia dewasa dimana terjadi sulit berkonsentrasi dan cenderung mudah lupa ataupun ceroboh terhadap banyak hal. Gangguan konsentrasi yang bersifat sementara banyak dipengaruhi oleh berbagai faktor seperti :\u003c/p\u003e\n\u003cul\u003e\n\u003cli\u003ekurang waktu istirahat / kurang waktu tidur\u003c/li\u003e\n\u003cli\u003etidur terlalu larut malam\u003c/li\u003e\n\u003cli\u003eterlambat makan\u003c/li\u003e\n\u003cli\u003easupan makan kurang\u003c/li\u003e\n\u003cli\u003edehidrasi\u003c/li\u003e\n\u003cli\u003ekedinginan\u003c/li\u003e\n\u003cli\u003edalam kondisi yang terdesak / banyak tekanan\u003c/li\u003e\n\u003c/ul\u003e\n\u003cp\u003eUntuk mengetahui kondisi yang Anda alami apakah gangguan konsentrasi yang dipengaruhi oleh hal-hal tertentu ataukah memang gangguan ADD sebaiknya Anda melakukan pemeriksaan lebih lanjut ke \u003ca href=\""https://www.alodokter.com/cari-dokter/dokter-jiwa\""\u003epsikiater \u003c/a\u003eagar dapat dilakukan pemeriksaan langsung dan pemeriksaan tambahan atau test-test yang diperlukan, apakah ada gangguan pada bagian saraf tertentu, dan untuk mendapatkan penanganan yang tepat. Anda juga perlu melatih kemampuan Anda untuk berkonsentrasi dengan membaca buku, menyelesaikan suatu pekerjaan dengan sesuai deadline, berhitung. berikut artikel yang dapat Anda baca \u003ca href=\""https://www.alodokter.com/adhd\""\u003eADHD\u003c/a\u003e, \u003ca href=\""https://www.alodokter.com/sulit-konsentrasi-ini-cara-mengatasinya\""\u003eatasi sulit konsentrasi\u003c/a\u003e\u003c/p\u003e\n\u003cp\u003esemoga bermanfaat, terimakasih\u003c/p\u003e\n\n""","8 Februari 2019, 03:53",dr. Danny
adhd,https://www.alodokter.com/komunitas/topic/menangani-gejala-anak-adhd,penyebab dan pengobatan ADHD pada anak usia 5 tahun,"""\n\n\u003cp\u003eSelamat siang Dok,\u003c/p\u003e\n\u003cp\u003eAnak saya berumur 5 Tahun laki laki, dari ciri2 gejala ADHD yang saya baca diinternet beberapa agak sesuai dengan pola tingkah laku anak saya. Dia terlalu aktif untuk beraktifitas diluar ruangan, terlalu ekspresif untuk sesuatu, untuk berbicara dua arah juga masih dibilang kurang. pertanyaan saya adakah therapy yang bisa dilakukan dirumah tanpa harus mengkonsumsi obat2an? Terimakasih Dok\u003c/p\u003e\n\n""","15 Januari 2019, 15:55","""\n\n\u003cp\u003eHalo Mika,\u003c/p\u003e\n\u003cp\u003eTerima kasih atas pertanyaannya di Alodokter,\u003c/p\u003e\n\u003cp\u003eKondisi \u003ca href=\""https://www.alodokter.com/adhd\""\u003eADHDatau\u003c/a\u003e\u003cem\u003e\u003ca href=\""https://www.alodokter.com/adhd\""\u003eattention deficit hyperactivity disorder\u003c/a\u003e\u003c/em\u003e merupakan suatu gangguan jangka panjang yang ditandai dengan adanya kesulitan konsentrasi atau memberikan atensi dan tindakan hiperaktif. Dapat muncul sejak anak-anak, terutama saat usia sekolah (6-12 tahun), dapat dibantu deteksi dengan gangguan belajar. Beberapa faktor risiko munculnya ADHD ini seperti faktor genetik, faktor kelainan sistem saraf pusat, atau ada pengaruh kelainan prematur.\u003c/p\u003e\n\u003cp\u003eGejala yang dapat timbul akibat ADHDmeliputi:\u003c/p\u003e\n\u003cul\u003e\n\u003cli\u003eSulit berkonsentrasi dan perhatiannya mudah teralihkan.\u003c/li\u003e\n\u003cli\u003eSulit mematuhi instruksi.\u003c/li\u003e\n\u003cli\u003eCenderung terlihat tidak mendengarkan.\u003c/li\u003e\n\u003cli\u003eTidak bisa diam atau selalu gelisah.\u003c/li\u003e\n\u003cli\u003eTidak sabar.\u003c/li\u003e\n\u003cli\u003eSering tidak menyelesaikan tugas yang diberikan dan beralih-alih tugas.\u003c/li\u003e\n\u003cli\u003eSelalu bergerak atau sangat aktif secara fisik.\u003c/li\u003e\n\u003cli\u003eTerus-menerus berbicara.\u003c/li\u003e\n\u003cli\u003eBertindak tanpa berpikir panjang.\u003c/li\u003e\n\u003cli\u003eKurang memahami bahaya atau konsekuensi buruk.\u003c/li\u003e\n\u003cli\u003eSering memotong pembicaraan orang lain.\u003c/li\u003e\n\u003c/ul\u003e\n\u003cp\u003eUntuk mendiagnosis ADHD sendiri perlu diperiksa dan dilakukan penilaian oleh beberapa profesional, seperti dokter spesialis anak dan psikolog perkembangan anak. Tidak semata-mata muncul gejala seperti diatas memastikan kondisi ADHD. Sehingga disarankan untuk melakukan konsultasi terlebih dahulu ke \u003ca href=\""https://www.alodokter.com/cari-dokter/dokter-anak\""\u003edokter spesialis anak\u003c/a\u003e terkait kondisi ini untuk mendapatkan informasi mengenai modalitas terapi yang sesuai untuk kondisi anak anda. Hindari memberikan pengobatan tanpa instruksi dan konsultasi dokter.\u003c/p\u003e\n\u003cp\u003eSemoga informasi ini membantu anda,\u003c/p\u003e\n\u003cp\u003e\u003c/p\u003e\n\u003cp\u003eSalam.\u003c/p\u003e\n\n""","16 Januari 2019, 09:06",dr. Arya Pradipa Adrianto Putra
adhd,https://www.alodokter.com/komunitas/topic/anak-saya-superaktif-dan-genius,Anak menjadi susah diam dan hiperaktif saat berada di keramaian setelah fisioterapi tortikolis,"""\n\n\u003cp\u003eDok anak saya umur 3 thn 5 bln, tapi susah diem ketika menghadiri acara2 diluar, apa itu pengaruh dari terapi fisioterapy ya, dlu anak saya waktu 3 bln di diagnosa toricolis dan sembuh selama pengobatan 4 bln\u003c/p\u003e\n""","21 Februari 2020, 00:15","""\n\n\u003cp\u003eAlo Bunda,\u003c/p\u003e\n\u003cp\u003eTerimakasih atas pertanyaannya.\u003c/p\u003e\n\u003cp\u003e\u003c/p\u003e\n\u003cp\u003e\u003ca href=\""https://www.alodokter.com/tortikolis\""\u003eTortikolis \u003c/a\u003emerupakan suatu kondisi dimana tonus otot leher terganggu sehingga membuat kepala dan leher miring menoleh ke salah satu sisi tubuh. Kondisi ini bisa cukup mengganggu penampilan, memicu nyeri, serta membatasi aktifitas penderitanya. Penyebabnya, bisa karena kelainan posisi dalam rahim, proses persalinan tertentu, cidera, genetik, serta beberapa faktor lainnya. Fisioterapi berkala seringnya bisa membantu mengatasi kondisi ini. Meski pada kasus yang lebih berat, bisa juga diberikan beberapa jenis obat atau modalitas terapi lainnya.\u003c/p\u003e\n\u003cp\u003eFisioterapi untuk penanganan tortikolis semestinya tidak lantas membuat anak menjadi sulit diam. Sulit diamnya anak Anda pun tidak selalu mengindikasikan bahwa anak Anda \u003ca href=\""https://www.alodokter.com/adhd\""\u003ehiperaktif \u003c/a\u003eatau genius. Sulit diam bisa murni disebabkan oleh anak Anda yang merasa bosan atau justru ingin mengeksplorasi lingkungan di sekitarnya. Bisa juga, sulit diam ini menandakan anak Anda merasa tidak nyaman, contohnya karena nyeri, gatal, lapar, dan sebagainya.\u003c/p\u003e\n\u003cp\u003eAnda bisa periksakan dulu anak Anda ke dokter atau \u003ca href=\""http://alodokter.com/cari-dokter/dokter-anak\""\u003edokter anak\u003c/a\u003e supaya kondisinya bisa dievaluasi lebih mendalam dan diberikan penanganan sesuai dengan penyebabnya ya.. Sementara ini, janganlah dulu panik. Dampingi terus anak Anda dalam bermain dan beraktifitas sehari-harinya. Buat aktifitas yang sesuai dengan usianya agar ia tidak bosan. Jangan beri anak gadget terlalu dini. Serta pastikan anak Anda selalu diawasi oleh orang dewasa, jangan dibiarkan bermain sendirian.\u003c/p\u003e\n\u003cp\u003eSemoga membantu ya..\u003c/p\u003e\n\n""","21 Februari 2020, 12:18",dr. Nadia Nurotul Fuadah
adhd,https://www.alodokter.com/komunitas/topic/autisme-7,Mengetahui bakat pada anak penderita autisme,"""\n\u003cp\u003eHalo dok,Saya punya kerabat berumur Â±9tahun dan ia mengidap autisme. Untungnya, dari pihak orangtuanya sangat baik dalam mendampinginya di kehidupan sehari-hari.Namun pada suatu saat, saya mengamati bahwa adik ini memiliki suatu keunikan. Ia sangat senang sekali mendengar bunyi dentingan koin yang menyentuh benda-benda keras. Ia bisa saja langsung tertawa dengan sangat gembira saat koin koin itu jatuh dan menimbulkan suara.Apakah ini merupakan hal umum yang terjadi pada anak-anak unik ini dok?Atau apakah ini merupakan tanda bahwa dia memiliki suatu bakat? Jika memang iya, Mungkinkan kita mendorongnya untuk mengembangkan bakat tsb? Bagaimana?Terimakasih:)\u003c/p\u003e\n""","3 Februari 2019, 19:01","""\n\n\u003cp\u003eAlo Florence, Terima kasih atas pertanyaannya.\u003c/p\u003e\n\u003cp\u003e\u003ca href=\""https://www.alodokter.com/autisme/gejala\""\u003eAutisme\u003c/a\u003e atau gangguan spektrum autisme (austism spectrum disorder (ASD)) adalah kondisi gangguang perkembangan otak yang menyebabkan penderitanya mengalami gangguan dalam berkomunikasi, bersosialisasi, dan berperilaku. Setaip penderita memiliki gejala dengan tingkat keparahan yang berbeda-beda. Gejalanya terkait dengan perubahan perilaku, gangguan berkomunikasi, dan gangguan berinteraksi dengan orang lain. Selain itu, kebanyakan penderita ASD juga memiliki obsesi atau ketertarikan terhadap benda-benda tertentu termasuk mendengarkan suara tertentu.Penderitanya mungkin juga dapat memiliki keterikatan pada benda, seperti mainan, patung-patung atau mobil mainan. Para ahli berpendapat bahwa ketertarikan atau obsesi ini lah tidak jarang merupakan kebahagiaan penderitanya dan dapat membantu penderitanya untuk menyalurkan minat untuk belajar atau melakukan suatu pekerjaan.\u003c/p\u003e\n\u003cp\u003eMendengar suara koin yang jatuh adalah salah satu ketertarikan kerabat Anda tersebut, Mungkin saja ketertarikan ini dapat disalurkan untuk melakukan suatu pekerjaan lain misalnya bermain musik. Anda dapat mencoba menganjurkan keluarganya untuk mengenalkan anak tersebut dengan suara musik dan perhatikan respon anak tersebut. Jika anak terlihat memberikan respon positif misalnya menjadi bahagia, anjurkan orang tua untuk melibatkan dokter spesialis anak atau terapisnya untuk membantu mengenalkan anak mengenai cara bermain musik tersebut. Memang akan menjadi tantangan tersendiri untuk mengenalkan anak tersebut pada alat musik jika Anda tidak mengetahui cara yang tepat.Oleh karena itu, silakan sarankan keluarga untuk berkonsultasi dengan \u003ca href=\""https://www.alodokter.com/cari-dokter/dokter-anak\""\u003edokter spesialis anak\u003c/a\u003e atau terapis yang berpengalaman menangani anak dengan autisme.\u003c/p\u003e\n\u003cp\u003eSemoga informasi ini berguna.\u003c/p\u003e\n\n""","3 Februari 2019, 20:52",dr. Aloisia Permata Sari 
adhd,https://www.alodokter.com/komunitas/topic/permasalahan-anak-adhd-di-usia-sekolah,Permasalahan anak adhd di usia sekolah,"""\n\u003cp\u003ePada anak adhd mereka kesulitan berkosentrsi sehingga banyak informasi penting terlewat. Dan informasi masi yang tidak penting malah yang di ambil.\r\nPertanyaan saya, informasi penting itu seperti apa? Dan informasi yang tidak penting itu Seperti apa? Contohnya! Terimakasih\u003c/p\u003e\n""","13 Desember 2018, 17:39","""\n\n\u003cp\u003eHalo,\u003c/p\u003e\n\u003cp\u003eInformasi yang dianggap penting atau tidak penting, tentunya berkaitan dengan usia anak, tugas perkembangan anak yang harus dicapai, tempat dan situasi dimana anak beraktivitas dan berinteraksi dengan lingkungan di sekitarnya.\u003c/p\u003e\n\u003cp\u003eADHD merupakan singkatan dari Atttention Deficit and Hyperactivity Dissorders, merupakan bentuk gangguan \u003cem\u003eneurobehaviour (gangguan perilaku sebagai akibat masalah perkembangan pada struktur/fisiologis kerja otak) yang membuat anak sulit memusatkan konsentrasi dan atau hiperaktivitas motorik serta impulsifitas yang menetap. Kondisi ADHD biasanya menetap dan membutuhkan penanganan modifikasi perilaku psikososial dalam aktivitas sehari-hari, latihan-latihan khusus baik fisik maupun psikologis untuk meregulasi impulsivitas serta meningkatkan konsentrasi terutama ketika belajar atau melakukan aktivitas tertentu dalam rentang waktu lebih dari 10 menit (bertahap meningkat sesuai kemampuan anak).\u003c/em\u003e\u003c/p\u003e\n\u003cp\u003eYang paling penting pada kondisi anak dengan ADHD yang memasuki usia sekolah adalah anak sudah memahami dan dapat melakukan aturan-aturan sosial yang berlaku dalam kelas\u0026amp;sekolah yang disupervisi oleh guru kelas dimana anak ditempatkan. Informasi penting lain yang perlu anak ketahui dan mampu kerjakan adalah menguasai materi pelajaran sekolah (dengan cara belajar yang sesuai dengan gaya anak) dan urutan aktivitas hidup sehari-hari.\u003c/p\u003e\n\u003cp\u003eAnak bahkan orang dewasa pasti lebih mudah mengingat dan memusatkan perhatian pada kegiatan maupun informasi yang memang menarik dan sesuai dengan minat/hobinya. Sehingga merupakan hal yang wajar bila anak dengan ADHDpun akan lebih mudah memusatkan perhatian dan mengingat informasi yang sesuai dengan minat/hobinya.\u003c/p\u003e\n\u003cp\u003eAnak dengan ADHD mungkin mengalami gangguan belajar, maka diperlukan penanganan Tim Tumbuh Kembang (Psikolog, Psikiater konsultan anak dan remaja, dan Dokter Spesialis Anak) dalam jangka panjang.\u003c/p\u003e\n\u003cp\u003eSemua hal tersebut tentu harus disesuaikan dengan kemampuan anak, tidak dapat dipaksakan, dan penanganan psikologis harus dimulai sejak usia sedini mungkin (awal sejak anak terdiagnosis ).\u003c/p\u003e\n\u003cp\u003e\u003ca href=\""https://www.alodokter.com/adhd.html\""\u003eBaca di sini\u003c/a\u003e mengenai ADHD.\u003c/p\u003e\n\u003cp\u003eDemikian info yang dapat Kami bagikan, semoga membantu Anda.\u003c/p\u003e\n\n""","14 Desember 2018, 13:38",dr. Caecilia Haryu Aryapti
adhd,https://www.alodokter.com/komunitas/topic/apa-yang-sebenar-terjadi-dan-apa-solusinya-dok,Anak belum bisa bicara di usia 4 tahun setelah riwayat kejang,"""\n\u003cp\u003emlm dok, saat usianya 1 tahun sdh bisa panggil atau ucap kata \""bapa\"" dan \""mama\"" dan responnya bagus skali.tp sejak dia sempat kejang hampir setengah jam sejak itu jg dia tdk prnh lagi mngucapkan satu katapun dan jika dipanggil susah untuk merespon tetapi sesekali dia menoleh jika dipanggil keras2.sekarang umurnya 4tahun 8bln dan sesekali dia bisa panggil kata \""bapa\"" dan \""mama\"" tetapi jika disuruh mnyebutkan lagi kata2 tsbt dia tdk merspon tetapi sesekali jika dia merespon dia hanya seperti orang berbicara tapi ejaannya tdk membentuk kata bahasa kadang kalau kita menyanyi dia juga mnyanyi tetapi lafalannya tdk membentuk kata kata.\u003c/p\u003e\n""","3 November 2018, 21:43","""\n\n\u003cp\u003eHalo Dollan, terimakasih atas pertanyaannya untuk Alodokter\u003c/p\u003e\n\u003cp\u003eÂ \u003c/p\u003e\n\u003cp\u003eDi usia 4 tahun, normalnya anak sudah dapat berbicara dengan lancar (bahkan bicara tanpa henti), sudah dapat menyebutkan nama dan usianya sendiri, sudah bisa menjawab pertanyaan yang simpel, bicara dengan kalimat yang lengkap, bicara dengan jelas dan dapat dimengerti oleh orang lain selain orang tuanya, menceritakan cerita. Bila hingga usia 4 tahun ini anak anda belum bisa bicara dengan jelas, bahkan hanya menyebutkan beberapa kata saja, maka kondisi tersebut adalah tidak normal.\u003c/p\u003e\n\u003cp\u003eGangguan yang terjadi pada anak anda dapat disebabkan oleh beberapa kemungkinan:\u003c/p\u003e\n\u003col\u003e\n\u003cli\u003eterjadi kerusakan otak saat terjadi kejang\u003c/li\u003e\n\u003cli\u003eadanya gangguan pendengaran pada anak\u003c/li\u003e\n\u003cli\u003eadanya gangguan perkembangan pada anak (misalnya \u003ca title=\""https://www.alodokter.com/autisme\"" href=\""https://www.alodokter.com/autisme\""\u003eautisme \u003c/a\u003eatau \u003ca title=\""https://www.alodokter.com/adhd.html\"" href=\""https://www.alodokter.com/adhd.html\""\u003eADHD\u003c/a\u003e)\u003c/li\u003e\n\u003cli\u003egangguan intelektual\u003c/li\u003e\n\u003cli\u003eSindrom Landau Kleffner, yaitu suatu gangguan langka pada anak dimana terjadi kehilangan komprehensi bahasa dan ekspresi verbal disertai dengan adanya abnormalitas gelombang otak (EEG) saat tidur dan (pada sebagian besar pasien) dapat pula ditemukan kejang.\u003c/li\u003e\n\u003cli\u003ekelainan genetik, metabolik, mitokondria, dan lain sebagainya\u003c/li\u003e\n\u003c/ol\u003e\n\u003cp\u003eSebaiknya anda segera membawa anak anda ke \u003ca title=\""https://www.alodokter.com/cari-dokter/dokter-anak\"" href=\""https://www.alodokter.com/cari-dokter/dokter-anak\""\u003edokter anak\u003c/a\u003e agar dapat dilakukan pemeriksaan lebih lanjut terhadap anak anda tersebut. Dokter akan memeriksa pertumbuhan anak (meliputi berat badan, tinggi badan, lingkar kepalanya), serta perkembangan anak (dari segi bahasa, kognitif, motorik kasar dan halus, perkembangan sosial dan emosional). Bila memang terdapat gangguan tertentu, dokter anak akan melakukan pemeriksaan lebih lanjut seperti melakukan pemeriksaan pendengaran, pemeriksaan otak seperti EEG, CT scan ataupun MRI otak.\u003c/p\u003e\n\u003cp\u003eKondisi anak anda ini harus segera dicaritahu penyebabnya. Anak anda juga harus segera mendapatkan terapi yang sesuai dengan penyebab tersebut, serta diperlukan juga terapi lainnya seperti terapi wicara. Bila dibiarkan, gangguan perkembangan ini bisa berlanjut hingga menyebabkan gangguan perkembangan lainnya dan gangguan fungsi sosial anak ke depannya.\u003c/p\u003e\n\u003cp\u003eÂ \u003c/p\u003e\n\u003cp\u003eSekian informasi dari saya, semoga cukup menjawab\u003c/p\u003e\n\u003cp\u003eÂ \u003c/p\u003e\n\u003ca\u003e\u003c/a\u003e\n\u003cp\u003eÂ \u003c/p\u003e\n\n""","4 November 2018, 03:44",dr. Irna Cecilia
