topik,URL,Title,Question,Question Date,Answer,Answer Date,By Doctor
adhd,https://www.alodokter.com/komunitas/topic/adhd-pada-orang-dewasa5620d1,Cara mengatasi Attention deficit hyperactivity disorder (ADHD) ,"""\n\n\u003cp\u003eMalam dok.Nama saya ek suswanti. Saya sekarang sedang proses screening putra saya yang berusia 4 tahun. Saya curiga dia ADHD. Dalam perjalanan proses screening, saya mendapati info ada unsur genetika. Dan saya menyadari suami saya sulit fokus. Sekarang dia selalu mencurigai saya. Sering marah. Dok, apa ciri2 adhd pd orang dewasa dan bagaimana penyembuhan nya.\u003c/p\u003e\n""","6 April 2020, 21:16","""\n\n\u003cp\u003eAlo Ek Suswanti, Terima kasih atas pertanyaannya.\u003c/p\u003e\n\u003cp\u003e\u003ca href=\""https://www.alodokter.com/adhd\""\u003e\u003cem\u003eAttention deficit hyperactivity disorder\u003c/em\u003e (ADHD)\u003c/a\u003e adalah suatu gangguan kesehatan mental yang membuat seseorang sulit untuk berkonsentrasi/ memusatkan perhatian, memiliki perilaku impulsif, dan lebih aktif dari biasanya. Gejala ADHD pada anak-anak sama dengan pada orang dewasa. Gejalanya dapat meliputi tidak dapat fokus mengerjakan suatu hal, perhatiannya mudah teralihkan, sulit mengikuti petunjuk untuk melakukan suatu hal, sering terlihat tidak berkonsentrasi ketika diajak berbicara, ceroboh, sulit untuk diam saja (tidak bisa melakukan aktivitas dengan tenang), memiliki kebiasaan menggerakkan bagian tubuh tertentu, banyak berbicara, sering memotong pembicaraan orang lain.\u003c/p\u003e\n\u003cp\u003eMudah mencurigai orang lain bukanlah gejala ADHD. Kondisi ini perlu dicaritahu lebih lanjut apakah merupakan suatu kondisi normal atau merupakan kepercayaan yang salah (delusi). Seseorang mudah mencurigai orang lain jika tidak memiliki rasa percaya pada orang tersebut, biasanya karena kejadian yang tidak menyenangkan di masa lalu, kurangnya komunikasi di antara mereka, atau memang ada perilaku Anda yang membuat suami Anda menjadi mudah curiga. Selain itu, kondisi ini bisa juga adalah delusi/ waham. \u003ca href=\""https://www.alodokter.com/penderita-gangguan-delusi-suka-meyakini-yang-aneh-aneh\""\u003eDelusi\u003c/a\u003e adalah kondisi di mana penderitanya memiliki keyakinan yang salah atau berbeda dengan kenyataan tetapi penderitanya tetap menyakininya. Contoh dari delusi misalnya: penderitanya merasa bahwa orang lain ingin membahayakan dirinya (waham kejar), penderitanya merasa dirinya memiliki kekuasaan besar dan identitas yang terkenal (waham kebesaran), dan penderitanya percaya bahwa pasangan tidak setia padanya tetapi tidak ada bukti kuat (waham cemburu). Kondisi yang Anda sampaikan mungkin juga disebabkan oleh waham cemburu ini. Seseorang yang memiliki delusi lebih mudah marah dan bisa mengalami \u003ca href=\""https://www.alodokter.com/halusinasi\""\u003ehalusinasi\u003c/a\u003e. Penyebab dari delusi sendiri bermacam-macam yaitu misalnya stres yang tinggi, penyalahgunaan obat-obatan terlarang dan minuman beralkohol, \u003ca href=\""https://www.alodokter.com/skizofrenia\""\u003eskizofrenia\u003c/a\u003e.\u003c/p\u003e\n\u003cp\u003eJika gejala ini sangat berlebihan dan tidak masuk akal seperti yang disebutkan di atas, maka mungkin saja suami Anda mengalami delusi. Untuk mengatasi kondisi ini tentu harus dipastikan dulu dengan pemeriksaan lebih lanjut dengan \u003ca href=\""https://www.alodokter.com/cari-dokter/dokter-jiwa\""\u003edokter spesialis jiwa/psikiater\u003c/a\u003e. Anda dapat mencoba mengajak suami Anda untuk berkonsultasi dengan dokterspesialis jiwa/psikiater karena dokter perlu melakukan tanya jawab pada suami Anda untuk mengetahui kondisinya sebelum menentukan penanganan lebih lanjut. Namun, jika suami Anda menunjukkan gejala yang membahayakan dirinya atau orang lain misalnya ingin bunuh diri atau orang lain, silakan segera membawa suami Anda ke IGD rumah sakit terdekat.\u003c/p\u003e\n\u003cp\u003eSambil menunggu konsultasi dengan dokter, Anda bisa mencoba untuk memperbaiki komunikasi dengan suami Anda karena dengan komunikasi yang baik dapat terbangun kepercayaan di antara Anda berdua.\u003c/p\u003e\n\u003cp\u003eSemoga membantu.\u003c/p\u003e\n\n""","7 April 2020, 08:34",dr. Aloisia Permata Sari 
adhd,https://www.alodokter.com/komunitas/topic/gangguan-adhd-pada-anak-usia-9-tahun,Cara agar anak penderita ADHD dapat fokus dengan baik,"""\n\n\u003cp\u003eMalam dok, adik saya didiagnosa ADHD pada usia 4 tahun, hal ini mempegaruhi konsentrasi dan daya ingat untuk mempelajari sesuatu hal. Kosakata yg dipelajari juga berkurang dok. Sempat 2 tahun menjalani terapi wicara dan meminum suplemen otak, namun pengaruhnya belum signifikan. Bagaimana cara agar anak ADHD bisa fokus dan menyerap pelajaran dengan baik? Terima kasih\u003c/p\u003e\n""","28 Agustus 2020, 22:58","""\n\n\u003cp\u003eAlo, terimakasih sudah bertanya di \u003ca href=\""http://alodokter.com\""\u003ealodokter.com\u003c/a\u003e\u003c/p\u003e\n\u003cp\u003e\u003ca href=\""https://www.alodokter.com/adhd/penanganan\""\u003eAttention deficit hyperactivity disorder(ADHD\u003c/a\u003e) adalahgangguanmental yang ditandai dengan anaksulit memusatkan perhatian, memiliki perilaku impulsif dan hiperaktif. Hal iniberdampak pada hubungan sosial anak dan prestasi anak di sekolah. Penyebab utama ADHD belum diketahui dengan pasti. Akan tetapi, kondisi ini diduga dipengaruhi oleh faktor genetik, lingkungan dan berkaitan dengan gangguan pada pola aliran listrik otak. Gejala ADHD ini dapat terbawa hingga dewasa.\u003c/p\u003e\n\u003cp\u003eKondisi ADHD tidak bisa disembuhkan secara sempurna. Pengobatan diberikan untuk meredakan gelaja agar penderitanya dapat menjalani hidup dengan normal. Pengobatan yang diperlukan adalah berupa obat kejiwaan dan psikoterapi. Oleh karena itu, berkonsultasilah secara rutin dengan dokter spesialis kejiwaan. Kemudian berikan adik obat secara teratur sesuai anjuran dokter. Jangan lupa untuk mengantarkan dan menemani adik menjalani psikoterapi. Kemudian ibu minta bimbingan dokter mengenai cara menghadapi anak ADHD.\u003c/p\u003e\n\u003cp\u003eSementara itu, ibu perlu menyiapkan diri dan lingkungan di rumah untuk membantu adik menjalani tahap pembelajaran. Yaitu meliputi :\u003cbr\u003e 1. Berikan waktu ibu sepenuhnya untuk adik. \u003cbr\u003e 2. Berikan adik makanan yang sehat dan bergizi. \u003cbr\u003e 3. Atur jadwal kegiatan adik dan sediakan waktu istirahat yang cukup untuk adik. \u003cbr\u003e 4. Batasi waktu adik menonton TV atau bermain HP. \u003cbr\u003e 5. Maksimalkan waktu belajar sambil bermain bersama adik dengan mengutamakan konsep belajar menggunakan aktivitas fisik.\u003c/p\u003e\n\u003cp\u003eDemikian semoga bermanfaat.\u003c/p\u003e\n\n""","29 Agustus 2020, 07:51",dr. Nira Hastati
adhd,https://www.alodokter.com/komunitas/topic/g-bisa-diam,Penyebab tubuh tidak bisa diam,"""\n\n\u003cp\u003eDok ada orang yg ga bisa diem bgt dia klo bediri gerak2, goyang2 gtu kakinya kdang smpe sebadan g bisa diam trus jg klo dduk paati kakinyya di gerakin klo gak tangannya trus klo jln g bsa pelan bwaannya mau lari trus itu kenpa ya dok kira2\u003c/p\u003e\n""","20 Maret 2020, 21:41","""\n\n\u003cp\u003eAlo Mamass Maslaha,\u003c/p\u003e\n\u003cp\u003eTungkai bawah yang bergoyang-goyang saat duduk perlu dibedakan dulu apakah gerakan volunter (bisa dikendalikan pasien, pasien sengaja melakukannya, disadari pasien) atau gerakan involunter (terjadi di luar kendali pasien, pasien tidak bisa menghentikannya).\u003c/p\u003e\n\u003cp\u003eOrang sering menggoyang-goyangkan kakinya pada kondisi berikut:\u003c/p\u003e\n\u003cul\u003e\n\u003cli\u003eBosan\u003c/li\u003e\n\u003cli\u003eCemas\u003c/li\u003e\n\u003cli\u003eMengantuk\u003c/li\u003e\n\u003cli\u003eUntuk meningkatkan konsentrasi\u003c/li\u003e\n\u003cli\u003eHiperaktivitas misalnya pada gangguan ADHD (attention deficit hyperactivity disorder)\u003c/li\u003e\n\u003c/ul\u003e\n\u003cp\u003eBisa juga gerakan involunter, kaki pasien bergerak tanpa ia bisa kendalikan misalnya pada penyakit berikut:\u003c/p\u003e\n\u003cul\u003e\n\u003cli\u003e\u003ca href=\""https://www.alodokter.com/penyakit-parkinson\""\u003ePenyakit Parkinson\u003c/a\u003e\u003c/li\u003e\n\u003cli\u003e\u003ca href=\""https://www.alodokter.com/penyakit-huntington\""\u003ePenyakit Huntington\u003c/a\u003e\u003c/li\u003e\n\u003cli\u003e\u003ca href=\""https://www.alodokter.com/tremor\""\u003eEssential tremor\u003c/a\u003e\u003c/li\u003e\n\u003cli\u003eHipertiroid\u003c/li\u003e\n\u003cli\u003eGangguan serebelum (otak kecil)\u003c/li\u003e\n\u003cli\u003eRestless leg syndrome dan masih banyak lagi\u003c/li\u003e\n\u003c/ul\u003e\n\u003cp\u003eGangguan-gangguan di atas dapat juga disertai dengan perubahan\u003cem\u003egait\u003c/em\u003e(gaya berjalan) yang khas. Untuk itu diperlukan pemeriksaan lebih lanjut secara langsung dengan dokter untuk melihat kelainan gerakan yang Anda maksudkan. Dokter juga perlu tahu usia pasien, jenis kelamin, faktor risiko, riwayat penyakit pasien dan keluarga, sebab beberapa jenis penyakit ada yang lebih sering terjadi di usia / ras/ jenis kelamin tertentu. Pemeriksaan lebih lanjut perlu dilakukan terutama bila kelainan pergerakan dan gaya berjalan tersebut disertai dengan keluhan berikut:\u003c/p\u003e\n\u003cul\u003e\n\u003cli\u003ePasien sulit berdiri atau berjalan\u003c/li\u003e\n\u003cli\u003ePerubahan perilaku pasien\u003c/li\u003e\n\u003cli\u003ePenurunan berat badan yang drastis\u003c/li\u003e\n\u003cli\u003eKejang\u003c/li\u003e\n\u003c/ul\u003e\n\u003cp\u003eBanyak pemeriksaan penunjang yang perlu dilakukan untuk mencari penyebab kelainan tersebut. Pemeriksaan penunjang yang perlu dilakukan disesuaikan dengan hasil pemeriksaan dan diagnosis banding penyakit yang dicurigai oleh dokter.\u003c/p\u003e\n\u003cp\u003eSebagian penyakit yang menimbulkan gangguan pergerakan bersifat akut yang artinya dapat membaik apabila penyebabnya teratasi. Namun adapula yang bersifat kronis (menahun) dan progresif (semakin lama kondisi pasien memburuk dan menjadi dependen dengan orang lain untuk melakukan aktivitasnya sehari-hari). Oleh karena itu tidak ada salahnya untuk memeriksakan diri ke dokter apabila keluhan pasien mengganggu aktivitasnya sehari-hari.\u003c/p\u003e\n\u003cp\u003eDemikian penjelasan dari saya, semoga bermanfaat.\u003c/p\u003e\n\n""","21 Maret 2020, 10:42",dr. Saphira Evani
adhd,https://www.alodokter.com/komunitas/topic/apakah-nonton-tv-dari-balita-bisa-menyebabkan-anak-adhd-,Apakah menonton tv sejak anak berusia 17 bulan bisa menyebabkan ADHD?,"""\n\n\u003cp\u003ehallo dokter..\u003c/p\u003e\n\u003cp\u003eKarena setiap imunisasi dapat masukan dari dokter terkait, sy sering merasa takut..pikiran yang menngangu saya..pertanyaan saya apakah nonton tv dapat menyebabkan anak ADHD/ ganggunan anak lain nya?anak saya berusia 17 bulan, di usia tersebut apakah sudah dapat terlihat?\u003c/p\u003e\n""","10 Maret 2020, 10:26","""\n\n\u003cp\u003eSalam Alodokter,\u003c/p\u003e\n\u003cp\u003eTerima kasih sudah bertanya di Alodokter.\u003c/p\u003e\n\u003cp\u003eAdanya kekhawatiran Anda terhadap ADHD pada anak, terutama bila anak Anda yang berusia 17 bulan sering melihat TV, adalh tidak benar. ADHD (Attention deficite hyperactivitu disorder) sendiri merupakan suatu gangguan mental yang memicu seorang anak mengalami kesulitan dalam memusatkan perhatian, dan disertai juga dengan perilaku impulsif serta hiperaktif, kondisi ini dapat berdampak pada hubungan sosial anak serta prestasi anak disekolah. Pasien dengan ADHD sering ditemui pada usia sebelum 12 tahun, gejala awal dapat dilihat pada anak usia sekitar 3 tahun. Sehingga untuk anak yang berusia 17 bulan, gejala awal ADHD sulit di ketahui,biasanya membutuhkan evaluasi selama 6 bulan untuk memastikan suatu adanya gangguan ADHD pada anak. Namun, beberapa gejala awal anak berusia sekitar 2 tahun atau masa sebelum usia sekolah dapat berupa:\u003c/p\u003e\n\u003col\u003e\n\u003cli\u003eAnak tampak gelisah berlebihan\u003c/li\u003e\n\u003cli\u003eAnak sering menggeliat-geliat\u003c/li\u003e\n\u003cli\u003eTidak dapat duduk tenang saat makan atau membaca buku\u003c/li\u003e\n\u003cli\u003eSering membuat suara yang mengganggu\u003c/li\u003e\n\u003cli\u003eBermain-main dari mainan satu ke lainnya\u003c/li\u003e\n\u003cli\u003eSecara konstan sering bergerak\u003c/li\u003e\n\u003cli\u003eKurang dapat fokus\u003c/li\u003e\n\u003cli\u003eTugas yang belum selesai\u003c/li\u003e\n\u003c/ol\u003e\n\u003cp\u003eNamun, semua ini bukan tanda pasti, karena memerlukan evaluasi langsung dari dokter spesialis anak secara berkala.\u003c/p\u003e\n\u003cp\u003eSedangkan penyebab \u003ca href=\""https://www.medicalnewstoday.com/articles/315518#symptoms\""\u003eADHD \u003c/a\u003esendiri adalah:\u003c/p\u003e\n\u003col\u003e\n\u003cli\u003eFaktor keturunan\u003c/li\u003e\n\u003cli\u003eKelahiran kurang bulan\u003c/li\u003e\n\u003cli\u003eKelainan pada sistem saraf pusat\u003c/li\u003e\n\u003cli\u003ePenggunaan NAPZA, alkohol, merokok selama kehamilan\u003c/li\u003e\n\u003cli\u003ePaparan racun pada anak\u003c/li\u003e\n\u003c/ol\u003e\n\u003cp\u003eSehingga, bila anak Anda suka melihat TV atau sering melihat TV, maka hal ini tidak menyebabkan ADHD. Karena ADHD sendiri sering disebabkan oleh adanya gangguan pada sistem saraf pusat/otak anak. Namun, anak yang terbiasa melihat TV, namun tidak terbiasa bermain dengan lingkungannya, dapat berisiko menyebabkan gangguan komunikasi dengan keluarga atau orang disekitarnya. Sebagai contoh:\u003c/p\u003e\n\u003col\u003e\n\u003cli\u003eperkembangan bicara anak terganggu, karena anak lebih sering melihat TV dari pada berbicara dan bermain dengan orang tua atau keluarga lain\u003c/li\u003e\n\u003cli\u003eAnak mudah takut bertemu dengan orang lain, karena jarang bersosialisasi dengan lainnya\u003c/li\u003e\n\u003cli\u003eMudah menangis karena dilarang melihat TV atau disuruh tidur\u003c/li\u003e\n\u003cli\u003ePerkembangan otot yang tidak optimal karena anak sering duduk dan jarang beraktivitas\u003c/li\u003e\n\u003cli\u003eMencontoh perilaku yang ada di televisi\u003c/li\u003e\n\u003c/ol\u003e\n\u003cp\u003eBila Anda merasa cemas, atau khawatir terhadap tumbuh kembang anak Anda, maka untuk melakukan evaluasi secara optimal, sebaiknya Anda berkonsultasi langsung dengan dokter anak Anda di bagian tumbuh kembang anak. \u003ca href=\""https://www.alodokter.com/cari-dokter/dokter-anak\""\u003eDokter \u003c/a\u003eakan melakukan wawancara berkaitan dengan kebiasaan dan perilaku anak Anda. Bila hasil evaluasi anak yang sudah dilakukan dokter memberikan indikasi yang wajar, maka tidak ada masalah yang memicu kehawatiran Anda. Namun, bila dokter menemukan beberapa hal berkaitan dengan risiko gangguan tumbuh kembang anak, maka dokter akan memberikan pengawasan dan evaluasi berkala untuk anak Anda. Dengan demikian, Anda dapat melanjutkan rencana dokter Anda dalam memberikan perawatan dan mendukung tumbuh kembang anak serta sosialisasi anak Anda.\u003c/p\u003e\n\u003cp\u003eUntuk saat ini, Anda dapat mengevaluasi kebiasaan anak Anda, dan batasi kebiasaan anak Anda bila hanya monoton melihat TV. Sebaiknya, berikan waktu anda bersama anak Anda dalam bermain dan melakukan hal menyenangkan, sehingga anak Anda akan menemukan pengalaman baru dalam masa tumbuh kembangnya.\u003c/p\u003e\n\u003cp\u003eDemikian info yang bisa kami sampaikan.\u003c/p\u003e\n\u003cp\u003eTerima kasih\u003c/p\u003e\n\n""","10 Maret 2020, 19:05",dr. Ulfi Umroni
adhd,https://www.alodokter.com/komunitas/topic/anak-yang-aktif,"Anak usia 4 tahun sangat aktif, suka memukul kepala, dan susah fokus","""\n\n\u003cp\u003ehalo dok saya mau tanya..saya punya anak 2, yg perama usia 4 tahun yg kedua 1,5 thn. anak pertama saya kelihatannya aktif bgt dok, trs dia suka jedot2in kepala/ memukul kepala klo kesel atau terlalu senang. anaknya g bisa diem bgt susah fokus. saya takut anak saya kena syndrom ADHD krn kurangnya perhatian dr saya. dan susahnya anak saya yg ke 2 nempel bgtt sm saya dan tidur pun ga bs berisik klo tdr kakakny berisik jd bgn jd saya susah pegang anak pertama. gmn ya dok mohon masukannya\u003c/p\u003e\n""","28 Januari 2021, 01:17","""\n\n\u003cp\u003eHalo Rima, terima kasih telah bertanya di alodokter.\u003c/p\u003e\n\u003cp\u003eSaya coba bantu jelaskan.\u003c/p\u003e\n\u003cp\u003e\u003ca href=\""https://www.alodokter.com/adhd\""\u003eADHD \u003c/a\u003eatau\u003cem\u003eattention deficit hyperactivity disorder\u003c/em\u003eadalah suatu gangguan dimana terjadinya gangguan dalam pemusatan perhatian, sehingga anak cenderung hiperaktif. Gejala utama dari ADHD adalah :\u003c/p\u003e\n\u003cul\u003e\n\u003cli\u003eGangguan dalam pemusatan perhatian\u003c/li\u003e\n\u003cli\u003eHiperaktif\u003c/li\u003e\n\u003cli\u003eImpulsif, memikirkan sesuatu tanpa tau akibat\u003c/li\u003e\n\u003c/ul\u003e\n\u003cp\u003ePenyebab ADHD belum diketahui secara pasti, namun faktor genetik dan lingkungan juga berpengaruh. Untuk memastikan apakah anak ibu benar mengalami ADHD atau tidak harus dilakukan pemeriksaan oleh dokter anak. Dokter nantinya akan melakukan beberapa pemeriksaan dan beberapa tes kepada anak anda.\u003c/p\u003e\n\u003cp\u003eJika hal tersebut sangat mengganggu aktivitas anda sehari-hari, anda disarankan untuk memeriksakan anak anda ke dokter anak, agar dapat dilakukan pengobatan yang tepat dan mencegah perburukan pada kemudian hari.\u003c/p\u003e\n\u003cp\u003eSemoga membantu, terima kasih.\u003c/p\u003e\n\n""","28 Januari 2021, 11:05",dr. Fajar Dwi Cahyo
adhd,https://www.alodokter.com/komunitas/topic/anak-saya-terkadang-membenturkan-kepala-ke-tembok-atau-badan-orang,Penyebab bayi usia 9 bulan sering membenturkan kepala ke tembok,"""\n\n\u003cp\u003eSiang dokter,\u003c/p\u003e\n\u003cp\u003eTerkadang anak saya suka membenturkan kepalanya ke tembok, tidak terlalu keras sih dok pelan2 ngebenturinnya. kadang juga suka pukul kepala sendiri kalo saya perhatiin juga sama selama tidak sakit dia tidak masalah tp kalo terlalu keras dan dia merasa sakit pasti dia menangis. sama satu hal lagi terkadang dia juga suka membenturkan mulutnya ke lantai atau badan orang lain. sekarang anak saya usia 9 bulan. saya selalu larang jika anak berbuat seperti itu, tetapi saya juga khawatir kalo kalo itu tindakan berbahaya.\u003c/p\u003e\n\u003cp\u003eTerima kasih\u003c/p\u003e\n""","13 April 2020, 15:00","""\n\n\u003cp\u003eAlo Anisah,\u003c/p\u003e\n\u003cp\u003eTerimakasih atas pertanyaannya.\u003c/p\u003e\n\u003cp\u003e\u003c/p\u003e\n\u003cp\u003eKarena rasa ingin tahunya yang teramat besar, banyak anak memang melakukan tindakan-tindakan yang tidak lazim, bahkan cenderung berbahaya baginya, termasuk juga dengan membenturkan kepalanya ke berbagai obyek seperti yang kerap anak Anda alami. Bisa jadi juga, anak membenturkan kepalanya sebagai bentuk protesnya saat keinginannya tidak terpenuhi (\u003ca href=\""https://www.alodokter.com/begini-cara-mengatasi-tantrum-pada-anak\""\u003etantrum\u003c/a\u003e). Seringnya, asalkan benturan ini tidak terlalu keras, kondisi ini tidak berbahaya. Sebaliknya, bila benturan yang terjadi cukup keras atau melibatkan sisi benda yang tajam, tentu hal ini bisa memicu efek yang negatif, seperti luka atau memar di kulit, hingga perdarahan di dalam otak, retak atau patah tulang, dan kondisi medis lain yang lebih serius. Pada beberapa kasus yang jarang, tindakan memukul-mukulkan kepala seperti yang anak Anda alami merujuk pada suatu gangguan, contohnya autisme, \u003ca href=\""http://alodokter.com/adhd\""\u003eADHD \u003c/a\u003e(attention deficit hyperactivity disorder), dan sebagainya.\u003c/p\u003e\n\u003cp\u003eSaran kami, Anda jangan dulu panik. Anda bisa siasati kondisi anak Anda tersebut dengan:\u003c/p\u003e\n\u003cul\u003e\n\u003cli\u003eAjak anak berbicara dengan bahasa yang mudah dimengerti, jelaskan padanya bahayanya bila ia terus mengulangi perbuatan tersebut, jadilah pendengar yang baik, ajarkan juga ia cara berkomunikasi yang baik bila menginginkan sesuatu\u003c/li\u003e\n\u003cli\u003eUsahakan jangan biarkan anak bermain sendiri tanpa pengawasan orang dewasa\u003c/li\u003e\n\u003cli\u003eDampingi anak beraktifitas, sesuai dengan usianya\u003c/li\u003e\n\u003cli\u003eJangan beri anak gadget atau tontonan-tontonan yang tidak sesuai usianya\u003c/li\u003e\n\u003cli\u003eAtur juga benda-benda di sekitar anak agar aman, contohnya dengan melapisi bagian tumpul furnitur dengan busa khusus, menjauhkan benda-benda berbahaya dari jangkauan anak, mengikat furnitur agar tidak jatuh menimpa anak, dan sebagainya\u003c/li\u003e\n\u003c/ul\u003e\n\u003cp\u003eAnda disarankan memeriksakan anak langusng ke dokter atau \u003ca href=\""http://alodokter.com/cari-dokter/dokter-anak\""\u003edokter anak \u003c/a\u003ebila mendapati anak Anda mengalami benturan yang keras, atau sampai membuatnya mengalami luka, muntah-muntah, nyeri kepala hebat, rewel berlebihan, dan mengalami keluhan-keluhan lain yang lebih berat. Pemeriksaan ini juga perlu dilakukan bila anak tampak tidak normal perkembangannya, misalnya sulit diajak bicara, tidak mampu berinteraksi dengan rekan sebahayanya, tidak fokus dalam beraktifitas, dan sebagainya.\u003c/p\u003e\n\u003cp\u003eSemoga membantu ya..\u003c/p\u003e\n\n""","13 April 2020, 15:44",dr. Nadia Nurotul Fuadah
adhd,https://www.alodokter.com/komunitas/topic/kesehatan-jiwac0aaa1,"Perbedaan hiperaktivitas, hiperkinesia, ADHD dan hiperaktif","""\n\n\u003cp\u003ehallo dok, saya ingin bertanya bedanya hiperaktivas, hiperkinesia, ADHD dan hiperaktif dok. apa keempat itu sama? jika berbeda tolong dijelaskan. terimakasih\u003c/p\u003e\n""","8 Februari 2020, 13:28","""\n\n\u003cp\u003eAlo Isna, Terima kasih atas pertanyaannya.\u003c/p\u003e\n\u003cp\u003eHiperkinesia adalah istilah yang menggambarkan adanya peningkatan pada aktivitas otot sehingga menyebabkan gerakan tidak normal pada otot tubuh, gerakan berlebihan, atau kombinasi keduanya. Hiperkinesia disebabkan oleh aktivitas listrik otak yang tidak normal yang terjadi pada area tertentu di otak. Hiperaktivitas atau hiperaktif adalah sebuah kondisi di mana seseorang menjadi lebih aktif. Kondisi ini dapat disertai dengan peningkatan gerakan tertentu yang berlebihan (hiperkinesia). Hiperaktivitas dapat disebabkan oleh hipertiroidisme, ADHD, gangguan pada otak, dan gangguan kesehatan mental lainnya.\u003c/p\u003e\n\u003cp\u003e\u003cem\u003eAttention deficit hyperactivity disorder\u003c/em\u003e (ADHD) adalah sebuah gangguan mental yang menyebabkan seorang anak menjadi sulit untuk memusatkan perhatian, impulsif, dan hiperaktif. Anak akan tampak sulit untuk diam and selalu ingin bergerak. Anak juga terlihat memiliki kebiasaan menggerakkan bagian tubuh tertentu, suka berlari-lari, banyak berbicara, tidak fokus dalam mengerjakan sesuatu. Penyebab pasti dari ADHD tidak diketahui dengan pasti namun, diperkirakan berkaitan dengan faktor genetik, kelahiran prematur, kerusakan otak selama janin di dalam kandungan, paparan zat berbahaya pada masa anak-anak.\u003c/p\u003e\n\u003cp\u003eSemoga informasi ini membantu Anda.\u003c/p\u003e\n\n""","8 Februari 2020, 18:23",dr. Aloisia Permata Sari 
adhd,https://www.alodokter.com/komunitas/topic/perubahan-mood-10,Cara mengatasi perubahan mood / mood swing,"""\n\u003cp\u003ehallo dok, akhir akhir ini saya merasa sangat aneh dengan mood saya, kadang saya merasa sangat sedih menangis lalu seketika saya sangat merasa sangat bahagia, saya tidak tau apa yang menyebabkan saya menangis dan saya bahagia. perubahan mood saya dari sedih ke senang saat saya mengingat sesuatu yang sepele, contohnya ketika saya sangat sedih saya mengingat ada file yang baru saya download, kemudian saya sangat senang tiba tiba\u003c/p\u003e\n""","23 Desember 2019, 17:18","""\n\n\u003cp\u003eHai Rizkana,\u003c/p\u003e\n\u003cp\u003ePerubahan suasana hati merupakan kondisi yang normal terjadi sehari-hari dan dapat dipengaruhi oleh banyak hal. Beberapa orang dapat mengalami perubahan mood lebih sering dari orang lainya, namun demikian bila perubahan mood yang terjadi sangat ekstrim atau menyebabkan gangguan dalam kehidupan sehari-hari maka kemungkinan besar kondisi tersebut membutuhkan perhatian medis karena dapat saja berkaitan dengan kondisi medis seperti gangguan bipolar.\u003c/p\u003e\n\u003cp\u003eSecara umum perubahan suasana hati ini disebut juga sebagai \u003cem\u003emood swing\u003c/em\u003e, mood swing yang normal terjadi sesekali, tidak menimbulkan gangguan dan umumnya memiliki pencetus/alasan perubahan mood terjadi. Berikut beberapa hal yang dapat mempengaruhi mood swing :\u003c/p\u003e\n\u003cul\u003e\n\u003cli\u003eKondisi hormon\u003c/li\u003e\n\u003cli\u003eKetidakseimbangan kimia otak\u003c/li\u003e\n\u003cli\u003eAkibat penyakit, contohnya pada penyakit tiroid\u003c/li\u003e\n\u003cli\u003eAkibat gangguan mental tertentu seperti ADHD, depresi, gangguan bipolar, gangguan kepribadian ataupun skizofrenia\u003c/li\u003e\n\u003c/ul\u003e\n\u003cp\u003eSebaiknya Anda berkonsultasi secara langsung dengan dokter bila keluhan yang Anda alami dirasakan menimbulkan gangguan. Namun demikian Anda juga dapat mencoba menjalankan gaya hidup sehat, melakukan kegiatan positif dan membuat \u003cem\u003emood diary\u003c/em\u003e bila diperlukan untuk mengatasi keluhan Anda.\u003c/p\u003e\n\u003cp\u003eBerikut artikel terkait pertanyaan Anda :\u003c/p\u003e\n\u003cp\u003e\u003ca href=\""https://www.alodokter.com/mood-swing-tidak-selamanya-normal-kenali-tanda-tandanya\""\u003eKenali tanda-tanda perubahan mood yang tidak normal\u003c/a\u003e\u003c/p\u003e\n\u003cp\u003eSemoga bermanfaat,\u003c/p\u003e\n\u003cp\u003edr. Budiono\u003c/p\u003e\n\n""","23 Desember 2019, 21:38",dr. Budiono
