topik,URL,Title,Question,Question Date,Answer,Answer Date,By Doctor
halusinasi,https://www.alodokter.com/komunitas/topic/penyakit-halusinasi-berlebihan-pada-remaja-16-tahun,Penyakit halusinasi berlebihan pada remaja 16 tahun,"""\u003cp\u003eRemaja usia 16 tahun selalu merasa hidupnya terancam dan akan di bunuh suwaktu-waktu padahal sebenernya di kelilingnya adalah lingkuman aman. apakah itu termasuk halusinasi berlebihan dokter?\u003c/p\u003e""","5 Juni 2024, 08:08","""\n\n\u003cp\u003eAlo, terimakasih atas pertanyaannya.\u003c/p\u003e\n\u003cp\u003e\u003c/p\u003e\n\u003cp\u003eKerap muncul perasaan terancam seperti akan dibunuh meski sesungguhnya tidak bisa jadi mengindikasikan \u003ca href=\""https://www.alodokter.com/penderita-gangguan-delusi-suka-meyakini-yang-aneh-aneh\""\u003edelusi \u003c/a\u003e(waham). Kondisi ini adalah salah satu gejala gangguan psikotik, yang dicirikan dengan ketidakmampuan penderita membedakan hal yang nyata dengan tidak, sehingga membuatnya meyakini dengan kuat apa yang dirasakannya, bahkan membuatnya berupaya meyakinkan orang lain bahwa perasaannya tersebut memang benar adanya. Delusi ada beberapa jenisnya, dan yang mirip dengan pernyataan Anda adalah delusi persekusi (waham kejar).\u003c/p\u003e\n\u003cp\u003eDelusi muncul utamanya akibat gangguan keseimbangan senyawa kimia di otak, yang kemudian mempengaruhi cara seseorang dalam berpikir, bersikap, dan berperilaku. Penyebab gangguan ini bersifat multifaktorial, yakni akibat kombinasi dari faktor genetik, biologis, lingkungan, dan status kesehatan secara umum. Pada beberapa kasus, delusi persekusi bisa muncul sebagai bagian dari gejala gangguan kejiwaan, seperti gangguan stres pasca trauma, depresi, gangguan bipolar, gangguan kepribadian, skizofrenia paranoid, dan sebagainya.\u003c/p\u003e\n\u003cp\u003eMenegakkan diagnosis delusi atau gangguan mental lainnya tidak bisa dilakukan sembarangan, melainkan perlu melibatkan juga wawancara terstruktur, pemeriksaan fisik, dan beragam tes penunjang. Untuk itu, agar kondisi yang Anda sebutkan bisa ditangani dengan optimal, diperlukan pemeriksaan yang komprehensif dulu oleh \u003ca href=\""https://www.alodokter.com/cari-dokter/psikolog\""\u003epsikolog \u003c/a\u003eatau \u003ca href=\""https://www.alodokter.com/cari-dokter/dokter-jiwa\""\u003epsikiater \u003c/a\u003eya..\u003c/p\u003e\n\u003cp\u003eSemoga membantu.\u003c/p\u003e\n\n""","5 Juni 2024, 15:23",dr. Nadia Nurotul Fuadah
halusinasi,https://www.alodokter.com/komunitas/topic/cara-meredakan-atau-penawar-ketika-mabuk-kecubung,Cara meredakan atau penawar ketika mabuk kecubung,"""\u003cp\u003etetangga saya anak kecil usia 13-14 th, saat bermain di kebun mereka mencoba makan kecubung. kemudian pulang2 halusinasi dan ngelantur. sepertinya mabuk kecubung dokter. dokter minta saranya apa yang harus dilakukan dok soalnya sudah sehari mereka belom sadar juga, dan penawar mabuk kecubung itu harus makan/ minum apa?\u003c/p\u003e""","30 Mei 2024, 12:53","""\n\n\u003cp\u003eAlo, selamat sore\u003c/p\u003e\n\u003cp\u003eKecubang merupakan tanaman yang mengandung berbagai nutrisi penting seperti karbohidrat, lemak, protein, serat serta tanin dan flavonoid yang bersifat antikosidan namun kecubang juga mengandung alkaloid tropana seperti atropin, skopolamin dan hioslamin yang berbahaya dikonsumsi, adapun bahayanya seperti :\u003c/p\u003e\n\u003cul\u003e\n\u003cli\u003eHalusinasi\u003c/li\u003e\n\u003cli\u003eKecanduan\u003c/li\u003e\n\u003cli\u003eLinglung\u003c/li\u003e\n\u003cli\u003ePeningkatan detak jantung\u003c/li\u003e\n\u003c/ul\u003e\n\u003cp\u003eJika terlanjur dikonsumsi dan menimbulkan gejala keracunan, sebaiknya segera temui dokter secara langsung ke UGD rumah sakit untuk mendapatkan penanganan lebih lanjut seperti detokfikasi, obat-obatan hingga pemantauan oleh dokter, jadi tidak bisa dibiarkan dirumah atau ditangani dirumah, jika tidak ditangani segera bisa menyebabkan kondisi yang lebih bahaya, jadi saran saya ke dokter segara saja.\u003c/p\u003e\n\u003cp\u003eSemoga dapat membantu\u003c/p\u003e\n\n""","30 Mei 2024, 18:30",dr. Riza Marlina
halusinasi,https://www.alodokter.com/komunitas/topic/apakah-pasien-cuci-darah-bisa-sampai-mengalami-halusinasi-,Apakah pasien cuci darah bisa sampai mengalami halusinasi?,"""\n\n\u003cp\u003eDok saya mau tanya tentang cuci darah. Tante saya baru beberapa kali cuci darah, Pertama kali cuci darah dia baik2 saja, cuci darah kedua kali dia menggigil dan cuci darah yg ketiga kalinya tante saya mengalami keanehan, kata keluarganya dia sering melihat banyak ular di kamarnya. Padahal tidak ada apa2 di kamarnya. Apakah pasien cuci darah bisa sampai mengalami halusinasi dok? tolon penjelasannya. terima kasih\u003c/p\u003e\n""","5 September 2022, 14:10","""\n\n\u003cp\u003eTerima kasih atas pertanyaanya.\u003c/p\u003e\n\u003cp\u003eCuci darah dilakukan untuk membuang sisa racun dalam tubuh yang seharusnya dapat terbuang melalui urin. Namun pada penderita gagal ginjal, racun tersebut tidak dapat dibuang akibat fungsi ginjal terganggu dan mengakibatkan perlu cuci darah untuk menggantikan fungsi ginjal.\u003c/p\u003e\n\u003cp\u003eCuci darah tersebut dilakukan untuk membuang racun yang menumpuk pada tubuh. Saat cuci darah dapat menimbulkan serangkaian \u003ca href=\""https://www.alodokter.com/ini-efek-samping-cuci-darah-yang-perlu-diketahui\""\u003eefek\u003c/a\u003e misalnya menjadi hipotensi, menggigil, mual, muntah dan sebagainya. Adanya halusinasi ataupun gangguan pada fungsi otak dapat menjadi komplikasi dari pengidap gagal ginjal. Kondisi ini dapat disebabkan karena racun terakumulasi dalam otak yang dapat menimbulkan gangguan terkait kesadaran. Namun untuk memastikannnya perlu dilakukan pemeriksaan oleh dokter penyakit dalam, terutama bila kondisi makin sering dirasakan. Selain itu sebaiknya rutin melakukan cuci darah sesuai dengan jadwalnya, menjaga asupan makanan, mengurangi asupan cairan, dan sebagainya.\u003c/p\u003e\n\u003cp\u003eTerima kasih, semoga membantu.\u003c/p\u003e\n\n""","5 September 2022, 15:57",dr. Riska Larasati
halusinasi,https://www.alodokter.com/komunitas/topic/merasa-ada-yang-berbisik-di-telinga-apakah-itu-termasuk-halusinasi,Merasa ada yang berbisik di telinga apakah itu termasuk halusinasi pendengaran?,"""\u003cp\u003eDok ini namanya apa ya dokter, teman saya curhat ketika akan tidur di malam hari, mata hampir benar2 terpejam dia sering mendengarkan suara seperti lelaki atau perempuan berbicara berbisik di telinganya dok. saya bilang dia halusinasi pendengaran. soalnya saya pernah liat kasus serupa di tv, apakah benar ini dokter?\u003c/p\u003e""","13 Mei 2024, 07:30","""\n\n\u003cp\u003eAlo, selamat pagi\u003c/p\u003e\n\u003cp\u003eUntuk kondisi dialamai teman anda harus dipastikan kebenarannya dengan cara menanyakan orang lain jika ia bersama orang lain, apakah orang tersebut mendengar suara yang ia dengar, jika tidak maka kondisi dialami temana anda bisa mengarah kepada halusinasi pendengaran. Ada beberapa penyebab dari halusinasi pendengaran seperti :\u003c/p\u003e\n\u003cul\u003e\n\u003cli\u003eGangguan pendengaran yang dimana ia akan mengalami keluhan berupa telinga berdengung\u003c/li\u003e\n\u003cli\u003eGangguan mental jika tidak disertai dengan keluhan telinga berdengung\u003c/li\u003e\n\u003cli\u003eGangguan tidur dimana kurang tidur dapat membuat seseorang rentan mengalami halusinasi\u003c/li\u003e\n\u003cli\u003eKonsumsi alkohol dan narkoba\u003c/li\u003e\n\u003c/ul\u003e\n\u003cp\u003eDiatas adalah beberapa kemungkinan yang bisa dialami teman anda, coba saranin dulu untuk teman anda melakukan beberapa hal seperti :\u003c/p\u003e\n\u003cul\u003e\n\u003cli\u003eTidur yang cukup 7-9 jam tiap malam, jadi coba perbaiki tidurnya\u003c/li\u003e\n\u003cli\u003eHindari penggunaan ear phone\u003c/li\u003e\n\u003cli\u003eKelola stres dengan baik dengan melakukan relaksasi\u003c/li\u003e\n\u003cli\u003eHindari konsumsi alkohol dan penggunana obat terlarang\u003c/li\u003e\n\u003c/ul\u003e\n\u003cp\u003eJika sudah melakukan tips diatas, namun keluhan terus dialami secara berulang sehingga menganggu aktivitas dan hubungan dengan orang sekitar, maka perlu menemui \u003ca href=\""https://www.alodokter.com/cari-dokter/dokter-jiwa?page=1\""\u003edokter psikiater\u003c/a\u003e untuk mendapatkan pemeriskaan dan penanganan lebih lanjut dengan tepat.\u003c/p\u003e\n\u003cp\u003eSemoga dapat membantu\u003c/p\u003e\n\n""","13 Mei 2024, 10:06",dr. Riza Marlina
halusinasi,https://www.alodokter.com/komunitas/topic/apa-saja-perbedaan-gangguan-delusi-dan-halusinasi-,Apa saja perbedaan gangguan delusi dan halusinasi?,"""\u003cp\u003eAlodokter, dok mau tanya dong dok, perbedaan delusi dan halusinasi itu apa ya dok? mohon jawabannya\u003c/p\u003e""","13 Mei 2024, 10:48","""\n\n\u003cp\u003eAlo, terimakasih atas pertanyaannya.\u003c/p\u003e\n\u003cp\u003e\u003c/p\u003e\n\u003cp\u003e\u003ca href=\""https://www.alodokter.com/sering-dianggap-sama-ini-perbedaan-ilusi-delusi-dan-halusinasi\""\u003eDelusi dan halusinasi \u003c/a\u003eadalah salah satu gejala yang muncul pada penderita skizofrenia dan gangguan psikotik lainnya. Penderita delusi dan halusinasi sama-sama kesulitan dalam membedakan hal yang nyata dan tidak nyata. Namun, meski nyaris serupa, delusi dan halusinasi sejatinya merupakan 2 kondisi yang berbeda. Berikut perbedaannya:\u003c/p\u003e\n\u003cul\u003e\n\u003cli\u003eDelusi (waham) membuat seseorang memiliki keyakinan yang kuat akan sesuatu yang sesungguhnya berlainan (menyimpang, berbeda) dari kenyataan yang terjadi. Sebagai contoh, penderita delusi bisa sangat yakin bahwa orang yang bicara di dekatnya sedang membicarakan dirinya, padahal sesungguhnya membicarakan hal lain (waham curiga). Contoh lain, penderita delusi bisa sangat yakin bahwa dirinya memiliki kekuatan atau kedudukan yang luar biasa yang membuat dirinya lebih dari orang lain, padahal sesungguhnya ia adalah orang biasa sebagaimana yang lain (waham kebesaran).\u003c/li\u003e\n\u003cli\u003eHalusinasi membuat seseorang memiliki keyakinan yang kuat akan sesuatu yang sesungguhnya tidak ada atau tidak terjadi sama sekali. Sebagai contoh, penderita halusinasi biasanya akan merasa mendengar bisikan atau bayangan orang lain, padahal sesungguhnya tidak ada suara atau bayangan apapun di sekitarnya.\u003c/li\u003e\n\u003c/ul\u003e\n\u003cp\u003eTentu, membedakan delusi dan halusinasi tidak selalu mudah. Membedakan apakah seseorang benar mengalami gangguan jiwa atau tidak pun tidak boleh juga sembarangan. Untuk itu, baiknya hal ini dikonsultasikan kembali ke ahlinya, yakni \u003ca href=\""https://www.alodokter.com/cari-dokter/psikolog\""\u003epsikolog \u003c/a\u003eatau \u003ca href=\""https://www.alodokter.com/cari-dokter/dokter-jiwa\""\u003epsikiater \u003c/a\u003eya..\u003c/p\u003e\n\u003cp\u003eSemoga membantu.\u003c/p\u003e\n\n""","13 Mei 2024, 20:51",dr. Nadia Nurotul Fuadah
halusinasi,https://www.alodokter.com/komunitas/topic/apa-yang-dimaksud-delusi-dan-bagaimana-mengatasinya-,Apa yang dimaksud delusi dan bagaimana mengatasinya?,"""\u003cp\u003eDok saya sedang ada masalah, sampai saya mengalami insomnia, sulit beraktivitas dan menjadi pemurung. Tapi saya juga merasa aneh. Saya terkadang merasa ada orang yg menguikuti saya kalau saya sedang di luar rumah dok, tapi sebenarnya itu tidak ada. selain itu saya sering mendegar hal2 yg orang lain tidak dengar. Apakah saya mengalami delusi dok? tapi sebenarnya saya kurang pahan apa yg dimaksud delusi dok. Tolong penjelasannya ya dok\u003c/p\u003e""","16 November 2023, 12:28","""\n\n\u003cp\u003eAlo, selamat siang\u003c/p\u003e\n\u003cp\u003edari keluhan anda sulit tidur dan sulit beraktivitas dan menjadi pemurung kondisi ini bisa mengarah pada gangguan psikis seperti \u003ca href=\""https://www.alodokter.com/depresi\""\u003edepresi\u003c/a\u003e, jika anda alami kondisi ini terlalu sering. depresi ialah gangguan mood yang ditandai dengan perasaan sedih yang mendalam dan kehilangan minat terhadap hal-hal yang disukai. deperesi lebih sering dialami oleh orang dewasa penyebabnya diduga terkait faktor genetik, hormon dan zat kimia di otak yang ada beberapa faktor menjadi pemicunya seperti :\u003c/p\u003e\n\u003cul\u003e\n\u003cli\u003eperistiwa traumatis\u003c/li\u003e\n\u003cli\u003etekanan batin misalanya masalah keluaraga, keungan, pekerjaan, percintaan dan lainnya\u003c/li\u003e\n\u003cli\u003epola pikir yang salah\u003c/li\u003e\n\u003c/ul\u003e\n\u003cp\u003edepresi merupakan penyakit jiwa yang harus ditangani karena dapat menyababkan gangguan emosional, perilaku dan kesehatan penderitanya. jika depersi anda alami tidak ditangani dan berkepanjangan dapat menimbulkan komplikasi munculnya gejala \u003ca href=\""https://www.alodokter.com/psikosis\""\u003epsikosis\u003c/a\u003e yaitu seperti halusinasi dan delusi. halusinasi ialah gangguan persepsi yang membuat seseorang mendengar, melihat, mencium dan merasa sesuatu yang sebenarnya tidak ada. sedangkan delusi ialah kondisi dimana penderita tidak dapat membedakan hal yang nyata dan tidak jadi ia menggap hal yang ia dengar, lihat dan alami ialah benar-benar terjadi dan meyakinkan orang lain bahwa itu fakta.\u003c/p\u003e\n\u003cp\u003euntuk kondisi anda kemungkinan anda mengalami halusinasi, kondisi ini tidak bisa anda biarkan sebaiknya anda melakukan konsultasi lebih lanjut ke \u003ca href=\""https://www.alodokter.com/cari-dokter/dokter-jiwa?page=1\""\u003edokter psikiater\u003c/a\u003e jika memang anda mengalami gangguan mood yang sudah lama. butuhnya bantuan dokter untuk bisa membantu kondisi anda sehingga anda bisa menjalani aktivitas seperti biasanya dan mencegah keburukan dari penyakit anda alami.\u003c/p\u003e\n\u003cp\u003esemoga dapat membantu\u003c/p\u003e\n\n""","16 November 2023, 15:04",dr. Riza Marlina
